{
  "generatedAt": "2026-02-03T16:40:01.649Z",
  "counts": {
    "indo": 1404,
    "woltReceipts": 85
  },
  "receipts": [
    {
      "id": "wolt-0",
      "kind": "receipt",
      "source": "gmail_wolt",
      "vendor": "Wolt",
      "date": "2024-04-05T16:45:17.000Z",
      "title": "Your order’s delivered: KFC Hafnarfirði 05.04.2024",
      "amountISK": null,
      "category": "Wolt",
      "raw": {
        "from": "\"Wolt\" <info@wolt.com>",
        "subject": "Your order’s delivered: KFC Hafnarfirði 05.04.2024",
        "date": "2024-04-05T16:45:17.000Z",
        "amountISK": null,
        "preview": "Thanks for ordering, Arnar! Here's your receipt: KFC Hafnarfirði April 05, 2024, 16:44 Order ID: 66102618b69ea821c4a91a7a Total ISK&nbsp; ‎4.352 ‎4.352 Your order documents are attached to this email. If you have any questions, please contact support. We care about your opinion! Let us know about it by clicking here and filling out this survey! -->"
      }
    },
    {
      "id": "wolt-1",
      "kind": "receipt",
      "source": "gmail_wolt",
      "vendor": "Wolt",
      "date": "2024-04-06T16:33:08.000Z",
      "title": "Your order’s delivered: KFC Hafnarfirði 06.04.2024",
      "amountISK": null,
      "category": "Wolt",
      "raw": {
        "from": "\"Wolt\" <info@wolt.com>",
        "subject": "Your order’s delivered: KFC Hafnarfirði 06.04.2024",
        "date": "2024-04-06T16:33:08.000Z",
        "amountISK": null,
        "preview": "Thanks for ordering, Arnar! Here's your receipt: KFC Hafnarfirði April 06, 2024, 16:32 Order ID: 661174099fa149b9cc5863d8 Total ISK&nbsp; ‎3.631 ‎3.631 Your order documents are attached to this email. If you have any questions, please contact support. We care about your opinion! Let us know about it by clicking here and filling out this survey! -->"
      }
    },
    {
      "id": "wolt-2",
      "kind": "receipt",
      "source": "gmail_wolt",
      "vendor": "Wolt",
      "date": "2024-04-06T21:01:44.000Z",
      "title": "Your order’s delivered: Ísbúðin Garðabæ 06.04.2024",
      "amountISK": null,
      "category": "Wolt",
      "raw": {
        "from": "\"Wolt\" <info@wolt.com>",
        "subject": "Your order’s delivered: Ísbúðin Garðabæ 06.04.2024",
        "date": "2024-04-06T21:01:44.000Z",
        "amountISK": null,
        "preview": "Thanks for ordering, Arnar! Here's your receipt: Ísbúðin Garðabæ April 06, 2024, 21:00 Order ID: 6611b3ec3942e2e8ea109982 Total ISK&nbsp; ‎3.090 ‎3.090 Your order documents are attached to this email. If you have any questions, please contact support. We care about your opinion! Let us know about it by clicking here and filling out this survey! -->"
      }
    },
    {
      "id": "wolt-3",
      "kind": "receipt",
      "source": "gmail_wolt",
      "vendor": "Wolt",
      "date": "2024-04-07T14:30:11.000Z",
      "title": "Your order’s delivered: KFC Hafnarfirði 07.04.2024",
      "amountISK": null,
      "category": "Wolt",
      "raw": {
        "from": "\"Wolt\" <info@wolt.com>",
        "subject": "Your order’s delivered: KFC Hafnarfirði 07.04.2024",
        "date": "2024-04-07T14:30:11.000Z",
        "amountISK": null,
        "preview": "Thanks for ordering, Arnar! Here's your receipt: KFC Hafnarfirði April 07, 2024, 14:29 Order ID: 6612a904ec1a590b7db795bd Total ISK&nbsp; ‎3.931 ‎3.931 Your order documents are attached to this email. If you have any questions, please contact support. We care about your opinion! Let us know about it by clicking here and filling out this survey! -->"
      }
    },
    {
      "id": "wolt-4",
      "kind": "receipt",
      "source": "gmail_wolt",
      "vendor": "Wolt",
      "date": "2024-04-20T15:25:09.000Z",
      "title": "Your order’s delivered: KFC Hafnarfirði 20.04.2024",
      "amountISK": null,
      "category": "Wolt",
      "raw": {
        "from": "\"Wolt\" <info@wolt.com>",
        "subject": "Your order’s delivered: KFC Hafnarfirði 20.04.2024",
        "date": "2024-04-20T15:25:09.000Z",
        "amountISK": null,
        "preview": "Thanks for ordering, Arnar! Here's your receipt: KFC Hafnarfirði April 20, 2024, 15:23 Order ID: 6623da606355d44c6d6b529e Total ISK&nbsp; ‎4.450 ****3700 ‎4.450 Your order documents are attached to this email. If you have any questions, please contact support. We care about your opinion! Let us know about it by clicking here and filling out this survey! -->"
      }
    },
    {
      "id": "wolt-5",
      "kind": "receipt",
      "source": "gmail_wolt",
      "vendor": "Wolt",
      "date": "2024-05-07T14:40:23.000Z",
      "title": "Your order’s delivered: KFC Berlin Europacenter 07.05.2024",
      "amountISK": null,
      "category": "Wolt",
      "raw": {
        "from": "\"Wolt\" <info@wolt.com>",
        "subject": "Your order’s delivered: KFC Berlin Europacenter 07.05.2024",
        "date": "2024-05-07T14:40:23.000Z",
        "amountISK": null,
        "preview": "Thanks for ordering, Arnar! Here's your receipt: KFC Berlin Europacenter May 07, 2024, 16:39 Order ID: 663a34f8b805e3f3dcc3113a Total EUR&nbsp; ‎22.71 ****3700 ‎22.71 Your order documents are attached to this email. If you have any questions, please contact support. We care about your opinion! Let us know about it by clicking here and filling out this survey! -->"
      }
    },
    {
      "id": "wolt-6",
      "kind": "receipt",
      "source": "gmail_wolt",
      "vendor": "Wolt",
      "date": "2024-05-08T10:58:18.000Z",
      "title": "Purchase receipt",
      "amountISK": null,
      "category": "Wolt",
      "raw": {
        "from": "\"Wolt\" <info@wolt.com>",
        "subject": "Purchase receipt",
        "date": "2024-05-08T10:58:18.000Z",
        "amountISK": null,
        "preview": "Thanks for ordering, Arnar! Here's your receipt: Milano Vice Pizza | Nollendorfplatz May 08, 2024, 12:57 Order ID: 663b503ff785cb5f9c66c675 Total EUR&nbsp; ‎24.76 ****3700 ‎24.76 Your order documents are attached to this email. If you have any questions, please contact support. We care about your opinion! Let us know about it by clicking here and filling out this survey! -->"
      }
    },
    {
      "id": "wolt-7",
      "kind": "receipt",
      "source": "gmail_wolt",
      "vendor": "Wolt",
      "date": "2024-06-21T21:16:20.000Z",
      "title": "Your order’s delivered: Ísbúðin Garðabæ 21.06.2024",
      "amountISK": null,
      "category": "Wolt",
      "raw": {
        "from": "\"Wolt\" <info@wolt.com>",
        "subject": "Your order’s delivered: Ísbúðin Garðabæ 21.06.2024",
        "date": "2024-06-21T21:16:20.000Z",
        "amountISK": null,
        "preview": "Thanks for ordering, Arnar! Here's your receipt: Ísbúðin Garðabæ June 21, 2024, 21:15 Order ID: 6675e99df2d554efa93c663f Total ISK&nbsp; ‎3.424 ****3700 ‎3.424 Your order documents are attached to this email. If you have any questions, please contact support. We care about your opinion! Let us know about it by clicking here and filling out this survey! -->"
      }
    },
    {
      "id": "wolt-8",
      "kind": "receipt",
      "source": "gmail_wolt",
      "vendor": "Wolt",
      "date": "2024-06-28T18:50:42.000Z",
      "title": "Your order’s delivered: Mandi Hæðasmára 28.06.2024",
      "amountISK": null,
      "category": "Wolt",
      "raw": {
        "from": "\"Wolt\" <info@wolt.com>",
        "subject": "Your order’s delivered: Mandi Hæðasmára 28.06.2024",
        "date": "2024-06-28T18:50:42.000Z",
        "amountISK": null,
        "preview": "Thanks for ordering, Arnar! Here's your receipt: Mandi Hæðasmára June 28, 2024, 18:49 Order ID: 667f00e94ec4067762a645a5 Total ISK&nbsp; ‎3.994 ****3700 ‎3.994 Your order documents are attached to this email. If you have any questions, please contact support. We care about your opinion! Let us know about it by clicking here and filling out this survey! -->"
      }
    },
    {
      "id": "wolt-9",
      "kind": "receipt",
      "source": "gmail_wolt",
      "vendor": "Wolt",
      "date": "2024-06-30T19:43:52.000Z",
      "title": "Your order’s delivered: Tokyo - Nýbýlavegur 30.06.2024",
      "amountISK": null,
      "category": "Wolt",
      "raw": {
        "from": "\"Wolt\" <info@wolt.com>",
        "subject": "Your order’s delivered: Tokyo - Nýbýlavegur 30.06.2024",
        "date": "2024-06-30T19:43:52.000Z",
        "amountISK": null,
        "preview": "Thanks for ordering, Arnar! Here's your receipt: Tokyo - Nýbýlavegur June 30, 2024, 19:42 Order ID: 6681ac229d79a5e7eba9f1a7 Total ISK&nbsp; ‎4.286 ****3700 ‎4.286 Your order documents are attached to this email. If you have any questions, please contact support. We care about your opinion! Let us know about it by clicking here and filling out this survey! -->"
      }
    },
    {
      "id": "wolt-10",
      "kind": "receipt",
      "source": "gmail_wolt",
      "vendor": "Wolt",
      "date": "2024-07-02T23:09:17.000Z",
      "title": "Your order’s delivered: Jolli 02.07.2024",
      "amountISK": null,
      "category": "Wolt",
      "raw": {
        "from": "\"Wolt\" <info@wolt.com>",
        "subject": "Your order’s delivered: Jolli 02.07.2024",
        "date": "2024-07-02T23:09:17.000Z",
        "amountISK": null,
        "preview": "Thanks for ordering, Arnar! Here's your receipt: Jolli July 02, 2024, 23:08 Order ID: 668480f477f6c32ee7760048 Total ISK&nbsp; ‎3.113 ****3700 ‎3.113 Your order documents are attached to this email. If you have any questions, please contact support. We care about your opinion! Let us know about it by clicking here and filling out this survey! -->"
      }
    },
    {
      "id": "wolt-11",
      "kind": "receipt",
      "source": "gmail_wolt",
      "vendor": "Wolt",
      "date": "2024-07-05T19:29:06.000Z",
      "title": "Your order’s delivered: Tokyo - Nýbýlavegur 05.07.2024",
      "amountISK": null,
      "category": "Wolt",
      "raw": {
        "from": "\"Wolt\" <info@wolt.com>",
        "subject": "Your order’s delivered: Tokyo - Nýbýlavegur 05.07.2024",
        "date": "2024-07-05T19:29:06.000Z",
        "amountISK": null,
        "preview": "Thanks for ordering, Arnar! Here's your receipt: Tokyo - Nýbýlavegur July 05, 2024, 19:27 Order ID: 6688401a37f70e03929f359e Total ISK&nbsp; ‎4.238 ****3700 ‎4.238 Your order documents are attached to this email. If you have any questions, please contact support. We care about your opinion! Let us know about it by clicking here and filling out this survey! -->"
      }
    },
    {
      "id": "wolt-12",
      "kind": "receipt",
      "source": "gmail_wolt",
      "vendor": "Wolt",
      "date": "2024-07-21T18:21:50.000Z",
      "title": "Your order’s delivered: Mandi Hæðasmára 21.07.2024",
      "amountISK": null,
      "category": "Wolt",
      "raw": {
        "from": "\"Wolt\" <info@wolt.com>",
        "subject": "Your order’s delivered: Mandi Hæðasmára 21.07.2024",
        "date": "2024-07-21T18:21:50.000Z",
        "amountISK": null,
        "preview": "Thanks for ordering, Arnar! Here's your receipt: Mandi Hæðasmára July 21, 2024, 18:20 Order ID: 669d4c0eed7db41bc41b7a00 Total ISK&nbsp; ‎3.845 ****3700 ‎3.845 Your order documents are attached to this email. If you have any questions, please contact support. We care about your opinion! Let us know about it by clicking here and filling out this survey! -->"
      }
    },
    {
      "id": "wolt-13",
      "kind": "receipt",
      "source": "gmail_wolt",
      "vendor": "Wolt",
      "date": "2024-07-23T18:49:42.000Z",
      "title": "Your order’s delivered: KFC Hafnarfirði 23.07.2024",
      "amountISK": null,
      "category": "Wolt",
      "raw": {
        "from": "\"Wolt\" <info@wolt.com>",
        "subject": "Your order’s delivered: KFC Hafnarfirði 23.07.2024",
        "date": "2024-07-23T18:49:42.000Z",
        "amountISK": null,
        "preview": "Thanks for ordering, Arnar! Here's your receipt: KFC Hafnarfirði July 23, 2024, 18:48 Order ID: 669ff610f1a5704430c314d8 Total ISK&nbsp; ‎3.577 ****3700 ‎3.577 Your order documents are attached to this email. If you have any questions, please contact support. We care about your opinion! Let us know about it by clicking here and filling out this survey! -->"
      }
    },
    {
      "id": "wolt-14",
      "kind": "receipt",
      "source": "gmail_wolt",
      "vendor": "Wolt",
      "date": "2024-08-21T19:42:02.000Z",
      "title": "Your order’s delivered: Mandi Hæðasmára 21.08.2024",
      "amountISK": null,
      "category": "Wolt",
      "raw": {
        "from": "\"Wolt\" <info@wolt.com>",
        "subject": "Your order’s delivered: Mandi Hæðasmára 21.08.2024",
        "date": "2024-08-21T19:42:02.000Z",
        "amountISK": null,
        "preview": "Thanks for ordering, Arnar! Here's your receipt: Mandi Hæðasmára August 21, 2024, 19:40 Order ID: 66c63d0f829ce395a83ae90c Total ISK&nbsp; ‎3.282 ****3700 ‎3.282 Your order documents are attached to this email. If you have any questions, please contact support. We care about your opinion! Let us know about it by clicking here and filling out this survey! -->"
      }
    },
    {
      "id": "wolt-15",
      "kind": "receipt",
      "source": "gmail_wolt",
      "vendor": "Wolt",
      "date": "2024-09-02T09:57:57.000Z",
      "title": "Your order’s delivered: KFC Hafnarfirði 01.09.2024",
      "amountISK": null,
      "category": "Wolt",
      "raw": {
        "from": "\"Wolt\" <info@wolt.com>",
        "subject": "Your order’s delivered: KFC Hafnarfirði 01.09.2024",
        "date": "2024-09-02T09:57:57.000Z",
        "amountISK": null,
        "preview": "Thanks for ordering, Arnar! Here's your receipt: KFC Hafnarfirði September 01, 2024, 19:51 Order ID: 66d4bbf93bd0f4c6e8716c9e Total ISK&nbsp; ‎3.500 ****3700 ‎3.500 Your order documents are attached to this email. If you have any questions, please contact support. We care about your opinion! Let us know about it by clicking here and filling out this survey! -->"
      }
    },
    {
      "id": "wolt-16",
      "kind": "receipt",
      "source": "gmail_wolt",
      "vendor": "Wolt",
      "date": "2024-09-02T11:50:40.000Z",
      "title": "Your order’s delivered: Ísbúðin Garðabæ 01.09.2024",
      "amountISK": null,
      "category": "Wolt",
      "raw": {
        "from": "\"Wolt\" <info@wolt.com>",
        "subject": "Your order’s delivered: Ísbúðin Garðabæ 01.09.2024",
        "date": "2024-09-02T11:50:40.000Z",
        "amountISK": null,
        "preview": "Thanks for ordering, Arnar! Here's your receipt: Ísbúðin Garðabæ September 01, 2024, 22:57 Order ID: 66d4e7f7252a9a5f37cab96a Total ISK&nbsp; ‎3.124 ****3700 ‎3.124 Your order documents are attached to this email. If you have any questions, please contact support. We care about your opinion! Let us know about it by clicking here and filling out this survey! -->"
      }
    },
    {
      "id": "wolt-17",
      "kind": "receipt",
      "source": "gmail_wolt",
      "vendor": "Wolt",
      "date": "2024-09-02T22:04:46.000Z",
      "title": "Your order’s delivered: Ísbúðin Garðabæ 02.09.2024",
      "amountISK": null,
      "category": "Wolt",
      "raw": {
        "from": "\"Wolt\" <info@wolt.com>",
        "subject": "Your order’s delivered: Ísbúðin Garðabæ 02.09.2024",
        "date": "2024-09-02T22:04:46.000Z",
        "amountISK": null,
        "preview": "Thanks for ordering, Arnar! Here's your receipt: Ísbúðin Garðabæ September 02, 2024, 21:21 Order ID: 66d627548422bafe6b212798 Total ISK&nbsp; ‎3.424 ****3700 ‎3.424 Your order documents are attached to this email. If you have any questions, please contact support. We care about your opinion! Let us know about it by clicking here and filling out this survey! -->"
      }
    },
    {
      "id": "wolt-18",
      "kind": "receipt",
      "source": "gmail_wolt",
      "vendor": "Wolt",
      "date": "2024-09-04T22:17:47.000Z",
      "title": "Your order’s delivered: Ísbúðin Garðabæ 04.09.2024",
      "amountISK": null,
      "category": "Wolt",
      "raw": {
        "from": "\"Wolt\" <info@wolt.com>",
        "subject": "Your order’s delivered: Ísbúðin Garðabæ 04.09.2024",
        "date": "2024-09-04T22:17:47.000Z",
        "amountISK": null,
        "preview": "Thanks for ordering, Arnar! Here's your receipt: Ísbúðin Garðabæ September 04, 2024, 22:16 Order ID: 66d8d86b003ab4a5df3424f4 Total ISK&nbsp; ‎3.424 ****3700 ‎3.424 Your order documents are attached to this email. If you have any questions, please contact support. We care about your opinion! Let us know about it by clicking here and filling out this survey! -->"
      }
    },
    {
      "id": "wolt-19",
      "kind": "receipt",
      "source": "gmail_wolt",
      "vendor": "Wolt",
      "date": "2024-09-05T20:14:27.000Z",
      "title": "Your order’s delivered: Ísbúðin Garðabæ 05.09.2024",
      "amountISK": null,
      "category": "Wolt",
      "raw": {
        "from": "\"Wolt\" <info@wolt.com>",
        "subject": "Your order’s delivered: Ísbúðin Garðabæ 05.09.2024",
        "date": "2024-09-05T20:14:27.000Z",
        "amountISK": null,
        "preview": "Thanks for ordering, Arnar! Here's your receipt: Ísbúðin Garðabæ September 05, 2024, 20:13 Order ID: 66da0dc4e08de38b2c2e87da Total ISK&nbsp; ‎3.724 ****3700 ‎3.724 Your order documents are attached to this email. If you have any questions, please contact support. We care about your opinion! Let us know about it by clicking here and filling out this survey! -->"
      }
    },
    {
      "id": "wolt-20",
      "kind": "receipt",
      "source": "gmail_wolt",
      "vendor": "Wolt",
      "date": "2024-09-06T20:03:37.000Z",
      "title": "Your order’s delivered: Bytes 06.09.2024",
      "amountISK": null,
      "category": "Wolt",
      "raw": {
        "from": "\"Wolt\" <info@wolt.com>",
        "subject": "Your order’s delivered: Bytes 06.09.2024",
        "date": "2024-09-06T20:03:37.000Z",
        "amountISK": null,
        "preview": "Thanks for ordering, Arnar! Here's your receipt: Bytes September 06, 2024, 20:02 Order ID: 66db4c2b7d3f1f974492ef3b Total ISK&nbsp; ‎5.229 ****3700 ‎5.229 Your order documents are attached to this email. If you have any questions, please contact support. We care about your opinion! Let us know about it by clicking here and filling out this survey! -->"
      }
    },
    {
      "id": "wolt-21",
      "kind": "receipt",
      "source": "gmail_wolt",
      "vendor": "Wolt",
      "date": "2024-09-06T21:07:54.000Z",
      "title": "Your order’s delivered: Ísbúðin Garðabæ 06.09.2024",
      "amountISK": null,
      "category": "Wolt",
      "raw": {
        "from": "\"Wolt\" <info@wolt.com>",
        "subject": "Your order’s delivered: Ísbúðin Garðabæ 06.09.2024",
        "date": "2024-09-06T21:07:54.000Z",
        "amountISK": null,
        "preview": "Thanks for ordering, Arnar! Here's your receipt: Ísbúðin Garðabæ September 06, 2024, 21:06 Order ID: 66db6b1f45bc270170288d37 Total ISK&nbsp; ‎1.950 ****3700 ‎0 Credits ‎1.950 Your order documents are attached to this email. If you have any questions, please contact support. We care about your opinion! Let us know about it by clicking here and filling out this survey! -->"
      }
    },
    {
      "id": "wolt-22",
      "kind": "receipt",
      "source": "gmail_wolt",
      "vendor": "Wolt",
      "date": "2024-09-07T19:55:17.000Z",
      "title": "Your order’s delivered: KFC Hafnarfirði 07.09.2024",
      "amountISK": null,
      "category": "Wolt",
      "raw": {
        "from": "\"Wolt\" <info@wolt.com>",
        "subject": "Your order’s delivered: KFC Hafnarfirði 07.09.2024",
        "date": "2024-09-07T19:55:17.000Z",
        "amountISK": null,
        "preview": "Thanks for ordering, Arnar! Here's your receipt: KFC Hafnarfirði September 07, 2024, 19:54 Order ID: 66dcaaac0524f8fc3bc9d1f8 Total ISK&nbsp; ‎3.974 ****3700 ‎3.217 Credits ‎757 Your order documents are attached to this email. If you have any questions, please contact support. We care about your opinion! Let us know about it by clicking here and filling out this survey! -->"
      }
    },
    {
      "id": "wolt-23",
      "kind": "receipt",
      "source": "gmail_wolt",
      "vendor": "Wolt",
      "date": "2024-09-14T18:53:37.000Z",
      "title": "Your order’s delivered: Ísbúðin Garðabæ 14.09.2024",
      "amountISK": null,
      "category": "Wolt",
      "raw": {
        "from": "\"Wolt\" <info@wolt.com>",
        "subject": "Your order’s delivered: Ísbúðin Garðabæ 14.09.2024",
        "date": "2024-09-14T18:53:37.000Z",
        "amountISK": null,
        "preview": "Thanks for ordering, Arnar! Here's your receipt: Ísbúðin Garðabæ September 14, 2024, 18:52 Order ID: 66e5d7e5a73bdba3481fd288 Total ISK&nbsp; ‎3.424 ****3700 ‎3.424 Your order documents are attached to this email. If you have any questions, please contact support. We care about your opinion! Let us know about it by clicking here and filling out this survey! -->"
      }
    },
    {
      "id": "wolt-24",
      "kind": "receipt",
      "source": "gmail_wolt",
      "vendor": "Wolt",
      "date": "2024-09-25T20:06:17.000Z",
      "title": "Your order’s delivered: Ísbúðin Garðabæ 25.09.2024",
      "amountISK": null,
      "category": "Wolt",
      "raw": {
        "from": "\"Wolt\" <info@wolt.com>",
        "subject": "Your order’s delivered: Ísbúðin Garðabæ 25.09.2024",
        "date": "2024-09-25T20:06:17.000Z",
        "amountISK": null,
        "preview": "Thanks for ordering, Arnar! Here's your receipt: Ísbúðin Garðabæ September 25, 2024, 20:05 Order ID: 66f468b05e215c02e53cc4b1 Total ISK&nbsp; ‎3.724 ****3700 ‎3.724 Your order documents are attached to this email. If you have any questions, please contact support. We care about your opinion! Let us know about it by clicking here and filling out this survey! -->"
      }
    },
    {
      "id": "wolt-25",
      "kind": "receipt",
      "source": "gmail_wolt",
      "vendor": "Wolt",
      "date": "2024-09-28T18:34:42.000Z",
      "title": "Your order’s delivered: Ísbúðin Garðabæ 28.09.2024",
      "amountISK": null,
      "category": "Wolt",
      "raw": {
        "from": "\"Wolt\" <info@wolt.com>",
        "subject": "Your order’s delivered: Ísbúðin Garðabæ 28.09.2024",
        "date": "2024-09-28T18:34:42.000Z",
        "amountISK": null,
        "preview": "Thanks for ordering, Arnar! Here's your receipt: Ísbúðin Garðabæ September 28, 2024, 18:33 Order ID: 66f849f01c97cd02236f85bc Total ISK&nbsp; ‎3.724 ****3700 ‎3.724 Your order documents are attached to this email. If you have any questions, please contact support. We care about your opinion! Let us know about it by clicking here and filling out this survey! -->"
      }
    },
    {
      "id": "wolt-26",
      "kind": "receipt",
      "source": "gmail_wolt",
      "vendor": "Wolt",
      "date": "2024-11-25T12:43:18.000Z",
      "title": "Your order’s delivered: Kjúklingastaðurinn Suðurveri 25.11.2024",
      "amountISK": null,
      "category": "Wolt",
      "raw": {
        "from": "\"Wolt\" <info@wolt.com>",
        "subject": "Your order’s delivered: Kjúklingastaðurinn Suðurveri 25.11.2024",
        "date": "2024-11-25T12:43:18.000Z",
        "amountISK": null,
        "preview": "Thanks for ordering, Arnar! Here's your receipt: Kjúklingastaðurinn Suðurveri November 25, 2024, 12:42 Order ID: 674466eabdd384c232eaf07b Total ISK&nbsp; ‎3.524 ****3700 ‎3.524 Your order documents are attached to this email. If you have any questions, please contact support. We care about your opinion! Let us know about it by clicking here and filling out this survey! -->"
      }
    },
    {
      "id": "wolt-27",
      "kind": "receipt",
      "source": "gmail_wolt",
      "vendor": "Wolt",
      "date": "2024-11-26T12:39:54.000Z",
      "title": "Your order’s delivered: Kínahofið 26.11.2024",
      "amountISK": null,
      "category": "Wolt",
      "raw": {
        "from": "\"Wolt\" <info@wolt.com>",
        "subject": "Your order’s delivered: Kínahofið 26.11.2024",
        "date": "2024-11-26T12:39:54.000Z",
        "amountISK": null,
        "preview": "Thanks for ordering, Arnar! Here's your receipt: Kínahofið November 26, 2024, 12:38 Order ID: 6745baa2ad573b2628e24508 Total ISK&nbsp; ‎3.041 ****3700 ‎3.041 Your order documents are attached to this email. If you have any questions, please contact support. We care about your opinion! Let us know about it by clicking here and filling out this survey! -->"
      }
    },
    {
      "id": "wolt-28",
      "kind": "receipt",
      "source": "gmail_wolt",
      "vendor": "Wolt",
      "date": "2024-12-04T12:06:11.000Z",
      "title": "Your order’s delivered: Grill 66 & Olís- Álfheimar 04.12.2024",
      "amountISK": null,
      "category": "Wolt",
      "raw": {
        "from": "\"Wolt\" <info@wolt.com>",
        "subject": "Your order’s delivered: Grill 66 & Olís- Álfheimar 04.12.2024",
        "date": "2024-12-04T12:06:11.000Z",
        "amountISK": null,
        "preview": "Thanks for ordering, Arnar! Here's your receipt: Grill 66 &amp; Olís- Álfheimar December 04, 2024, 12:04 Order ID: 67503e5e9cb9da79ccc301df Total ISK&nbsp; ‎3.270 ****3700 ‎3.270 Your order documents are attached to this email. If you have any questions, please contact support. We care about your opinion! Let us know about it by clicking here and filling out this survey! -->"
      }
    },
    {
      "id": "wolt-29",
      "kind": "receipt",
      "source": "gmail_wolt",
      "vendor": "Wolt",
      "date": "2024-12-09T11:54:56.000Z",
      "title": "Your order’s delivered: AsianFood 09.12.2024",
      "amountISK": null,
      "category": "Wolt",
      "raw": {
        "from": "\"Wolt\" <info@wolt.com>",
        "subject": "Your order’s delivered: AsianFood 09.12.2024",
        "date": "2024-12-09T11:54:56.000Z",
        "amountISK": null,
        "preview": "Thanks for ordering, Arnar! Here's your receipt: AsianFood December 09, 2024, 11:53 Order ID: 6756d3ca862bcddec0da920b Total ISK&nbsp; ‎3.674 ****3700 ‎3.674 Your order documents are attached to this email. If you have any questions, please contact support. We care about your opinion! Let us know about it by clicking here and filling out this survey! -->"
      }
    },
    {
      "id": "wolt-30",
      "kind": "receipt",
      "source": "gmail_wolt",
      "vendor": "Wolt",
      "date": "2024-12-16T12:42:00.000Z",
      "title": "Your order’s delivered: Lemon Kringlan 16.12.2024",
      "amountISK": null,
      "category": "Wolt",
      "raw": {
        "from": "\"Wolt\" <info@wolt.com>",
        "subject": "Your order’s delivered: Lemon Kringlan 16.12.2024",
        "date": "2024-12-16T12:42:00.000Z",
        "amountISK": null,
        "preview": "Thanks for ordering, Arnar! Here's your receipt: Lemon Kringlan December 16, 2024, 12:40 Order ID: 676017320c24e94181496710 Total ISK&nbsp; ‎4.030 ****3700 ‎3.471 Discount ‎559 Your order documents are attached to this email. If you have any questions, please contact support. We care about your opinion! Let us know about it by clicking here and filling out this survey! -->"
      }
    },
    {
      "id": "wolt-31",
      "kind": "receipt",
      "source": "gmail_wolt",
      "vendor": "Wolt",
      "date": "2024-12-18T12:17:42.000Z",
      "title": "Your order’s delivered: Lemon Kringlan 18.12.2024",
      "amountISK": null,
      "category": "Wolt",
      "raw": {
        "from": "\"Wolt\" <info@wolt.com>",
        "subject": "Your order’s delivered: Lemon Kringlan 18.12.2024",
        "date": "2024-12-18T12:17:42.000Z",
        "amountISK": null,
        "preview": "Thanks for ordering, Arnar! Here's your receipt: Lemon Kringlan December 18, 2024, 12:16 Order ID: 6762b65937b2afc25b71703b Total ISK&nbsp; ‎3.587 ****3700 ‎3.587 Your order documents are attached to this email. If you have any questions, please contact support. We care about your opinion! Let us know about it by clicking here and filling out this survey! -->"
      }
    },
    {
      "id": "wolt-32",
      "kind": "receipt",
      "source": "gmail_wolt",
      "vendor": "Wolt",
      "date": "2024-12-19T12:26:30.000Z",
      "title": "Your order’s delivered: Lemon Suðurlandsbraut 19.12.2024",
      "amountISK": null,
      "category": "Wolt",
      "raw": {
        "from": "\"Wolt\" <info@wolt.com>",
        "subject": "Your order’s delivered: Lemon Suðurlandsbraut 19.12.2024",
        "date": "2024-12-19T12:26:30.000Z",
        "amountISK": null,
        "preview": "Thanks for ordering, Arnar! Here's your receipt: Lemon Suðurlandsbraut December 19, 2024, 12:25 Order ID: 676406437a6f18b3bd61d547 Total ISK&nbsp; ‎3.587 ****3700 ‎3.587 Your order documents are attached to this email. If you have any questions, please contact support. We care about your opinion! Let us know about it by clicking here and filling out this survey! -->"
      }
    },
    {
      "id": "wolt-33",
      "kind": "receipt",
      "source": "gmail_wolt",
      "vendor": "Wolt",
      "date": "2025-01-11T18:05:08.000Z",
      "title": "Your order’s delivered: Mandi Hæðasmára 11.01.2025",
      "amountISK": null,
      "category": "Wolt",
      "raw": {
        "from": "\"Wolt\" <info@wolt.com>",
        "subject": "Your order’s delivered: Mandi Hæðasmára 11.01.2025",
        "date": "2025-01-11T18:05:08.000Z",
        "amountISK": null,
        "preview": "Thanks for ordering, Arnar! Here's your receipt: Mandi Hæðasmára January 11, 2025, 18:04 Order ID: 6782ac6bfe039102672ceefb Total ISK&nbsp; ‎3.440 ****3700 ‎3.440 Your order documents are attached to this email. If you have any questions, please contact support. We care about your opinion! Let us know about it by clicking here and filling out this survey! -->"
      }
    },
    {
      "id": "wolt-34",
      "kind": "receipt",
      "source": "gmail_wolt",
      "vendor": "Wolt",
      "date": "2025-01-19T19:04:49.000Z",
      "title": "Your order’s delivered: Lemon Hafnarfjörður 19.01.2025",
      "amountISK": null,
      "category": "Wolt",
      "raw": {
        "from": "\"Wolt\" <info@wolt.com>",
        "subject": "Your order’s delivered: Lemon Hafnarfjörður 19.01.2025",
        "date": "2025-01-19T19:04:49.000Z",
        "amountISK": null,
        "preview": "Thanks for ordering, Arnar! Here's your receipt: Lemon Hafnarfjörður January 19, 2025, 19:03 Order ID: 678d47cc12032e8da46389f5 Total ISK&nbsp; ‎3.744 ****3700 ‎3.744 Your order documents are attached to this email. If you have any questions, please contact support. We care about your opinion! Let us know about it by clicking here and filling out this survey! -->"
      }
    },
    {
      "id": "wolt-35",
      "kind": "receipt",
      "source": "gmail_wolt",
      "vendor": "Wolt",
      "date": "2025-01-31T15:45:47.000Z",
      "title": "Your order’s delivered: Krua Thai - Bæjarlind 31.01.2025",
      "amountISK": null,
      "category": "Wolt",
      "raw": {
        "from": "\"Wolt\" <info@wolt.com>",
        "subject": "Your order’s delivered: Krua Thai - Bæjarlind 31.01.2025",
        "date": "2025-01-31T15:45:47.000Z",
        "amountISK": null,
        "preview": "Thanks for ordering, Arnar! Here's your receipt: Krua Thai - Bæjarlind January 31, 2025, 15:43 Order ID: 679ceafcd573a12c7cd3e5c7 Total ISK&nbsp; ‎4.007 ****3700 ‎4.007 Your order documents are attached to this email. If you have any questions, please contact support. We care about your opinion! Let us know about it by clicking here and filling out this survey! -->"
      }
    },
    {
      "id": "wolt-36",
      "kind": "receipt",
      "source": "gmail_wolt",
      "vendor": "Wolt",
      "date": "2025-02-02T18:25:47.000Z",
      "title": "Your order’s delivered: Krua Thai - Bæjarlind 02.02.2025",
      "amountISK": null,
      "category": "Wolt",
      "raw": {
        "from": "\"Wolt\" <info@wolt.com>",
        "subject": "Your order’s delivered: Krua Thai - Bæjarlind 02.02.2025",
        "date": "2025-02-02T18:25:47.000Z",
        "amountISK": null,
        "preview": "Thanks for ordering, Arnar! Here's your receipt: Krua Thai - Bæjarlind February 02, 2025, 18:24 Order ID: 679fa7aa465d068482767b16 Total ISK&nbsp; ‎3.360 ****3700 ‎3.360 Your order documents are attached to this email. If you have any questions, please contact support. We care about your opinion! Let us know about it by clicking here and filling out this survey! -->"
      }
    },
    {
      "id": "wolt-37",
      "kind": "receipt",
      "source": "gmail_wolt",
      "vendor": "Wolt",
      "date": "2025-02-11T14:50:27.000Z",
      "title": "Your order’s delivered: Grill66 mini & Olís - Garðabæ 11.02.2025",
      "amountISK": null,
      "category": "Wolt",
      "raw": {
        "from": "\"Wolt\" <info@wolt.com>",
        "subject": "Your order’s delivered: Grill66 mini & Olís - Garðabæ 11.02.2025",
        "date": "2025-02-11T14:50:27.000Z",
        "amountISK": null,
        "preview": "Thanks for ordering, Arnar! Here's your receipt: Grill66 mini &amp; Olís - Garðabæ February 11, 2025, 14:48 Order ID: 67ab5f59a10f5d6252c229cf Total ISK&nbsp; ‎3.817 ****3700 ‎3.424 Discount ‎393 Your order documents are attached to this email. If you have any questions, please contact support. We care about your opinion! Let us know about it by clicking here and filling out this survey! -->"
      }
    },
    {
      "id": "wolt-38",
      "kind": "receipt",
      "source": "gmail_wolt",
      "vendor": "Wolt",
      "date": "2025-02-11T14:51:15.000Z",
      "title": "Tip Receipt",
      "amountISK": null,
      "category": "Wolt",
      "raw": {
        "from": "\"Wolt\" <info@wolt.com>",
        "subject": "Tip Receipt",
        "date": "2025-02-11T14:51:15.000Z",
        "amountISK": null,
        "preview": "Thanks for the tip, Arnar Here's your receipt: Courier Partner Tip February 11, 2025, 14:48 Order ID: 67ab5f59a10f5d6252c229cf Total ISK&nbsp; ‎600 4633 72** **** 3700 ‎600 Your order documents are attached to this email. If you have any questions, please contact support. We care about your opinion! Let us know about it by clicking here and filling out this survey! -->"
      }
    },
    {
      "id": "wolt-39",
      "kind": "receipt",
      "source": "gmail_wolt",
      "vendor": "Wolt",
      "date": "2025-02-18T12:01:58.000Z",
      "title": "Your order’s delivered: Krua Thai - Bæjarlind 18.02.2025",
      "amountISK": null,
      "category": "Wolt",
      "raw": {
        "from": "\"Wolt\" <info@wolt.com>",
        "subject": "Your order’s delivered: Krua Thai - Bæjarlind 18.02.2025",
        "date": "2025-02-18T12:01:58.000Z",
        "amountISK": null,
        "preview": "Thanks for ordering, Arnar! Here's your receipt: Krua Thai - Bæjarlind February 18, 2025, 12:00 Order ID: 67b4715998ce6563ece6c44c Total ISK&nbsp; ‎3.400 ****3700 ‎1.450 Credits ‎1.950 Your order documents are attached to this email. If you have any questions, please contact support. We care about your opinion! Let us know about it by clicking here and filling out this survey! -->"
      }
    },
    {
      "id": "wolt-40",
      "kind": "receipt",
      "source": "gmail_wolt",
      "vendor": "Wolt",
      "date": "2025-02-23T13:37:53.000Z",
      "title": "Your order’s delivered: KFC Kópavogi 23.02.2025",
      "amountISK": null,
      "category": "Wolt",
      "raw": {
        "from": "\"Wolt\" <info@wolt.com>",
        "subject": "Your order’s delivered: KFC Kópavogi 23.02.2025",
        "date": "2025-02-23T13:37:53.000Z",
        "amountISK": null,
        "preview": "Thanks for ordering, Arnar! Here's your receipt: KFC Kópavogi February 23, 2025, 13:36 Order ID: 67bb1e692355f6ad5977d399 Total ISK&nbsp; ‎3.646 ****3700 ‎3.646 Your order documents are attached to this email. If you have any questions, please contact support. We care about your opinion! Let us know about it by clicking here and filling out this survey! -->"
      }
    },
    {
      "id": "wolt-41",
      "kind": "receipt",
      "source": "gmail_wolt",
      "vendor": "Wolt",
      "date": "2025-02-24T13:09:49.000Z",
      "title": "Your order’s delivered: Krambúðin - Kársnes 24.02.2025",
      "amountISK": null,
      "category": "Wolt",
      "raw": {
        "from": "\"Wolt\" <info@wolt.com>",
        "subject": "Your order’s delivered: Krambúðin - Kársnes 24.02.2025",
        "date": "2025-02-24T13:09:49.000Z",
        "amountISK": null,
        "preview": "Thanks for ordering, Arnar! Here's your receipt: Krambúðin - Kársnes February 24, 2025, 13:08 Order ID: 67bc68740f65c230f16eefdf Total ISK&nbsp; ‎6.682 ****3700 ‎6.247 Discount ‎435 Your order documents are attached to this email. If you have any questions, please contact support. We care about your opinion! Let us know about it by clicking here and filling out this survey! -->"
      }
    },
    {
      "id": "wolt-42",
      "kind": "receipt",
      "source": "gmail_wolt",
      "vendor": "Wolt",
      "date": "2025-02-24T13:23:57.000Z",
      "title": "Your order’s delivered: Krua Thai - Bæjarlind 24.02.2025",
      "amountISK": null,
      "category": "Wolt",
      "raw": {
        "from": "\"Wolt\" <info@wolt.com>",
        "subject": "Your order’s delivered: Krua Thai - Bæjarlind 24.02.2025",
        "date": "2025-02-24T13:23:57.000Z",
        "amountISK": null,
        "preview": "Thanks for ordering, Arnar! Here's your receipt: Krua Thai - Bæjarlind February 24, 2025, 13:22 Order ID: 67bc6d778128af2899bad547 Total ISK&nbsp; ‎3.870 ****3700 ‎3.870 Your order documents are attached to this email. If you have any questions, please contact support. We care about your opinion! Let us know about it by clicking here and filling out this survey! -->"
      }
    },
    {
      "id": "wolt-43",
      "kind": "receipt",
      "source": "gmail_wolt",
      "vendor": "Wolt",
      "date": "2025-02-27T16:28:16.000Z",
      "title": "Your order’s delivered: KFC Hafnarfirði 27.02.2025",
      "amountISK": null,
      "category": "Wolt",
      "raw": {
        "from": "\"Wolt\" <info@wolt.com>",
        "subject": "Your order’s delivered: KFC Hafnarfirði 27.02.2025",
        "date": "2025-02-27T16:28:16.000Z",
        "amountISK": null,
        "preview": "Thanks for ordering, Arnar! Here's your receipt: KFC Hafnarfirði February 27, 2025, 16:27 Order ID: 67c08dfc4ded3d90f5215939 Total ISK&nbsp; ‎3.894 ****3700 ‎3.365 Discount ‎529 Your order documents are attached to this email. If you have any questions, please contact support. We care about your opinion! Let us know about it by clicking here and filling out this survey! -->"
      }
    },
    {
      "id": "wolt-44",
      "kind": "receipt",
      "source": "gmail_wolt",
      "vendor": "Wolt",
      "date": "2025-02-28T11:43:37.000Z",
      "title": "Your order’s delivered: Sbarro Smáralind 28.02.2025",
      "amountISK": null,
      "category": "Wolt",
      "raw": {
        "from": "\"Wolt\" <info@wolt.com>",
        "subject": "Your order’s delivered: Sbarro Smáralind 28.02.2025",
        "date": "2025-02-28T11:43:37.000Z",
        "amountISK": null,
        "preview": "Thanks for ordering, Arnar! Here's your receipt: Sbarro Smáralind February 28, 2025, 11:42 Order ID: 67c199d856bc367a1d5b3ac9 Total ISK&nbsp; ‎3.541 ****3700 ‎3.541 Your order documents are attached to this email. If you have any questions, please contact support. We care about your opinion! Let us know about it by clicking here and filling out this survey! -->"
      }
    },
    {
      "id": "wolt-45",
      "kind": "receipt",
      "source": "gmail_wolt",
      "vendor": "Wolt",
      "date": "2025-03-04T12:16:09.000Z",
      "title": "Your order’s delivered: Sbarro Smáralind 04.03.2025",
      "amountISK": null,
      "category": "Wolt",
      "raw": {
        "from": "\"Wolt\" <info@wolt.com>",
        "subject": "Your order’s delivered: Sbarro Smáralind 04.03.2025",
        "date": "2025-03-04T12:16:09.000Z",
        "amountISK": null,
        "preview": "Thanks for ordering, Arnar! Here's your receipt: Sbarro Smáralind March 04, 2025, 12:06 Order ID: 67c6e7e44549c2e5a184825e Total ISK&nbsp; ‎3.491 ****3700 ‎3.491 Your order documents are attached to this email. If you have any questions, please contact support. We care about your opinion! Let us know about it by clicking here and filling out this survey! -->"
      }
    },
    {
      "id": "wolt-46",
      "kind": "receipt",
      "source": "gmail_wolt",
      "vendor": "Wolt",
      "date": "2025-03-10T18:23:53.000Z",
      "title": "Your order’s delivered: Sbarro Smáralind 10.03.2025",
      "amountISK": null,
      "category": "Wolt",
      "raw": {
        "from": "\"Wolt\" <info@wolt.com>",
        "subject": "Your order’s delivered: Sbarro Smáralind 10.03.2025",
        "date": "2025-03-10T18:23:53.000Z",
        "amountISK": null,
        "preview": "Thanks for ordering, Arnar! Here's your receipt: Sbarro Smáralind March 10, 2025, 18:22 Order ID: 67cf283b55a4610b2884eb23 Total ISK&nbsp; ‎3.660 ****3700 ‎3.660 Your order documents are attached to this email. If you have any questions, please contact support. We care about your opinion! Let us know about it by clicking here and filling out this survey! -->"
      }
    },
    {
      "id": "wolt-47",
      "kind": "receipt",
      "source": "gmail_wolt",
      "vendor": "Wolt",
      "date": "2025-03-11T13:40:50.000Z",
      "title": "Your order’s delivered: Wok to Walk - Hafnarfjörður 11.03.2025",
      "amountISK": null,
      "category": "Wolt",
      "raw": {
        "from": "\"Wolt\" <info@wolt.com>",
        "subject": "Your order’s delivered: Wok to Walk - Hafnarfjörður 11.03.2025",
        "date": "2025-03-11T13:40:50.000Z",
        "amountISK": null,
        "preview": "Thanks for ordering, Arnar! Here's your receipt: Wok to Walk - Hafnarfjörður March 11, 2025, 13:39 Order ID: 67d039767c751464193e5d8b Total ISK&nbsp; ‎3.310 ****3700 ‎2.739 Discount ‎571 Your order documents are attached to this email. If you have any questions, please contact support. We care about your opinion! Let us know about it by clicking here and filling out this survey! -->"
      }
    },
    {
      "id": "wolt-48",
      "kind": "receipt",
      "source": "gmail_wolt",
      "vendor": "Wolt",
      "date": "2025-03-17T15:38:20.000Z",
      "title": "Your order’s delivered: Sbarro Smáralind 17.03.2025",
      "amountISK": null,
      "category": "Wolt",
      "raw": {
        "from": "\"Wolt\" <info@wolt.com>",
        "subject": "Your order’s delivered: Sbarro Smáralind 17.03.2025",
        "date": "2025-03-17T15:38:20.000Z",
        "amountISK": null,
        "preview": "Thanks for ordering, Arnar! Here's your receipt: Sbarro Smáralind March 17, 2025, 15:37 Order ID: 67d83c24fd4e52c5d88c0629 Total ISK&nbsp; ‎3.660 ****3700 ‎3.660 Your order documents are attached to this email. If you have any questions, please contact support. We care about your opinion! Let us know about it by clicking here and filling out this survey! -->"
      }
    },
    {
      "id": "wolt-49",
      "kind": "receipt",
      "source": "gmail_wolt",
      "vendor": "Wolt",
      "date": "2025-03-17T19:58:48.000Z",
      "title": "Your order’s delivered: Ísbúðin Garðabæ 17.03.2025",
      "amountISK": null,
      "category": "Wolt",
      "raw": {
        "from": "\"Wolt\" <info@wolt.com>",
        "subject": "Your order’s delivered: Ísbúðin Garðabæ 17.03.2025",
        "date": "2025-03-17T19:58:48.000Z",
        "amountISK": null,
        "preview": "Thanks for ordering, Arnar! Here's your receipt: Ísbúðin Garðabæ March 17, 2025, 19:57 Order ID: 67d87b863fd95acdd4eb6f90 Total ISK&nbsp; ‎3.499 ****3700 ‎3.499 Your order documents are attached to this email. If you have any questions, please contact support. We care about your opinion! Let us know about it by clicking here and filling out this survey! -->"
      }
    },
    {
      "id": "wolt-50",
      "kind": "receipt",
      "source": "gmail_wolt",
      "vendor": "Wolt",
      "date": "2025-03-20T18:23:27.000Z",
      "title": "Your order’s delivered: KFC Hafnarfirði 20.03.2025",
      "amountISK": null,
      "category": "Wolt",
      "raw": {
        "from": "\"Wolt\" <info@wolt.com>",
        "subject": "Your order’s delivered: KFC Hafnarfirði 20.03.2025",
        "date": "2025-03-20T18:23:27.000Z",
        "amountISK": null,
        "preview": "Thanks for ordering, Arnar! Here's your receipt: KFC Hafnarfirði March 20, 2025, 18:21 Order ID: 67dc5954101bb04e9e0c075f Total ISK&nbsp; ‎3.305 ****3700 ‎3.305 Your order documents are attached to this email. If you have any questions, please contact support. We care about your opinion! Let us know about it by clicking here and filling out this survey! -->"
      }
    },
    {
      "id": "wolt-51",
      "kind": "receipt",
      "source": "gmail_wolt",
      "vendor": "Wolt",
      "date": "2025-03-29T17:18:26.000Z",
      "title": "Your order’s delivered: KFC Hafnarfirði 29.03.2025",
      "amountISK": null,
      "category": "Wolt",
      "raw": {
        "from": "\"Wolt\" <info@wolt.com>",
        "subject": "Your order’s delivered: KFC Hafnarfirði 29.03.2025",
        "date": "2025-03-29T17:18:26.000Z",
        "amountISK": null,
        "preview": "Thanks for ordering, Arnar! Here's your receipt: KFC Hafnarfirði March 29, 2025, 17:17 Order ID: 67e827a2294040656c086f1b Total ISK&nbsp; ‎3.305 ****3700 ‎3.305 Your order documents are attached to this email. If you have any questions, please contact support. We care about your opinion! Let us know about it by clicking here and filling out this survey! -->"
      }
    },
    {
      "id": "wolt-52",
      "kind": "receipt",
      "source": "gmail_wolt",
      "vendor": "Wolt",
      "date": "2025-03-31T15:26:46.000Z",
      "title": "Your order’s delivered: KFC Hafnarfirði 31.03.2025",
      "amountISK": null,
      "category": "Wolt",
      "raw": {
        "from": "\"Wolt\" <info@wolt.com>",
        "subject": "Your order’s delivered: KFC Hafnarfirði 31.03.2025",
        "date": "2025-03-31T15:26:46.000Z",
        "amountISK": null,
        "preview": "Thanks for ordering, Arnar! Here's your receipt: KFC Hafnarfirði March 31, 2025, 15:24 Order ID: 67eaafb3cc7977c280885b39 Total ISK&nbsp; ‎4.463 ****3700 ‎4.463 Your order documents are attached to this email. If you have any questions, please contact support. We care about your opinion! Let us know about it by clicking here and filling out this survey! -->"
      }
    },
    {
      "id": "wolt-53",
      "kind": "receipt",
      "source": "gmail_wolt",
      "vendor": "Wolt",
      "date": "2025-03-31T20:11:39.000Z",
      "title": "Your order’s delivered: Ísbúðin Garðabæ 31.03.2025",
      "amountISK": null,
      "category": "Wolt",
      "raw": {
        "from": "\"Wolt\" <info@wolt.com>",
        "subject": "Your order’s delivered: Ísbúðin Garðabæ 31.03.2025",
        "date": "2025-03-31T20:11:39.000Z",
        "amountISK": null,
        "preview": "Thanks for ordering, Arnar! Here's your receipt: Ísbúðin Garðabæ March 31, 2025, 20:06 Order ID: 67eaf09ec5dae98f0bbe796d Total ISK&nbsp; ‎3.399 ****3700 ‎3.399 Your order documents are attached to this email. If you have any questions, please contact support. We care about your opinion! Let us know about it by clicking here and filling out this survey! -->"
      }
    },
    {
      "id": "wolt-54",
      "kind": "receipt",
      "source": "gmail_wolt",
      "vendor": "Wolt",
      "date": "2025-04-08T16:34:34.000Z",
      "title": "Your order’s delivered: Sbarro Smáralind 08.04.2025",
      "amountISK": null,
      "category": "Wolt",
      "raw": {
        "from": "\"Wolt\" <info@wolt.com>",
        "subject": "Your order’s delivered: Sbarro Smáralind 08.04.2025",
        "date": "2025-04-08T16:34:34.000Z",
        "amountISK": null,
        "preview": "Thanks for ordering, Arnar! Here's your receipt: Sbarro Smáralind April 08, 2025, 16:33 Order ID: 67f54c1735c19cd188e0749a Total ISK&nbsp; ‎3.248 ****3700 ‎3.248 Your order documents are attached to this email. If you have any questions, please contact support. We care about your opinion! Let us know about it by clicking here and filling out this survey! -->"
      }
    },
    {
      "id": "wolt-55",
      "kind": "receipt",
      "source": "gmail_wolt",
      "vendor": "Wolt",
      "date": "2025-05-07T13:13:16.000Z",
      "title": "Your order’s delivered: Grill 66 & Olís- Álfheimar 07.05.2025",
      "amountISK": null,
      "category": "Wolt",
      "raw": {
        "from": "\"Wolt\" <info@wolt.com>",
        "subject": "Your order’s delivered: Grill 66 & Olís- Álfheimar 07.05.2025",
        "date": "2025-05-07T13:13:16.000Z",
        "amountISK": null,
        "preview": "Thanks for ordering, Arnar! Here's your receipt: Grill 66 &amp; Olís- Álfheimar May 07, 2025, 13:12 Order ID: 681b53c52cad7b47638a7fe8 Total ISK&nbsp; ‎4.580 ****3700 ‎4.580 Your order documents are attached to this email. If you have any questions, please contact support. We care about your opinion! Let us know about it by clicking here and filling out this survey! -->"
      }
    },
    {
      "id": "wolt-56",
      "kind": "receipt",
      "source": "gmail_wolt",
      "vendor": "Wolt",
      "date": "2025-05-13T19:40:41.000Z",
      "title": "Your order’s delivered: Kínahofið 13.05.2025",
      "amountISK": null,
      "category": "Wolt",
      "raw": {
        "from": "\"Wolt\" <info@wolt.com>",
        "subject": "Your order’s delivered: Kínahofið 13.05.2025",
        "date": "2025-05-13T19:40:41.000Z",
        "amountISK": null,
        "preview": "Thanks for ordering, Arnar! Here's your receipt: Kínahofið May 13, 2025, 19:39 Order ID: 6823981c587443afc7b37277 Total ISK&nbsp; ‎3.552 ****3700 ‎3.552 Your order documents are attached to this email. If you have any questions, please contact support. We care about your opinion! Let us know about it by clicking here and filling out this survey! -->"
      }
    },
    {
      "id": "wolt-57",
      "kind": "receipt",
      "source": "gmail_wolt",
      "vendor": "Wolt",
      "date": "2025-06-09T16:31:09.000Z",
      "title": "Your order’s delivered: Grill66 mini & Olís - Garðabæ 09.06.2025",
      "amountISK": null,
      "category": "Wolt",
      "raw": {
        "from": "\"Wolt\" <info@wolt.com>",
        "subject": "Your order’s delivered: Grill66 mini & Olís - Garðabæ 09.06.2025",
        "date": "2025-06-09T16:31:09.000Z",
        "amountISK": null,
        "preview": "Thanks for ordering, Arnar! Here's your receipt: Grill66 mini &amp; Olís - Garðabæ June 09, 2025, 16:26 Order ID: 684704fa838dd456e4e14f99 Total ISK&nbsp; ‎2.970 ****3700 ‎747 Credits ‎2.223 Your order documents are attached to this email. If you have any questions, please contact support. We care about your opinion! Let us know about it by clicking here and filling out this survey! -->"
      }
    },
    {
      "id": "wolt-58",
      "kind": "receipt",
      "source": "gmail_wolt",
      "vendor": "Wolt",
      "date": "2025-06-10T15:50:05.000Z",
      "title": "Your order’s delivered: Viking Kebab 10.06.2025",
      "amountISK": null,
      "category": "Wolt",
      "raw": {
        "from": "\"Wolt\" <info@wolt.com>",
        "subject": "Your order’s delivered: Viking Kebab 10.06.2025",
        "date": "2025-06-10T15:50:05.000Z",
        "amountISK": null,
        "preview": "Thanks for ordering, Arnar! Here's your receipt: Viking Kebab June 10, 2025, 15:48 Order ID: 68484fd9c539096682302631 Total ISK&nbsp; ‎4.186 ****3700 ‎4.186 Your order documents are attached to this email. If you have any questions, please contact support. We care about your opinion! Let us know about it by clicking here and filling out this survey! -->"
      }
    },
    {
      "id": "wolt-59",
      "kind": "receipt",
      "source": "gmail_wolt",
      "vendor": "Wolt",
      "date": "2025-06-11T18:14:16.000Z",
      "title": "Your order’s delivered: KFC Kópavogi 11.06.2025",
      "amountISK": null,
      "category": "Wolt",
      "raw": {
        "from": "\"Wolt\" <info@wolt.com>",
        "subject": "Your order’s delivered: KFC Kópavogi 11.06.2025",
        "date": "2025-06-11T18:14:16.000Z",
        "amountISK": null,
        "preview": "Thanks for ordering, Arnar! Here's your receipt: KFC Kópavogi June 11, 2025, 18:10 Order ID: 6849bee2674cfa0118161b75 Total ISK&nbsp; ‎4.075 ****3700 ‎4.075 Your order documents are attached to this email. If you have any questions, please contact support. We care about your opinion! Let us know about it by clicking here and filling out this survey! -->"
      }
    },
    {
      "id": "wolt-60",
      "kind": "receipt",
      "source": "gmail_wolt",
      "vendor": "Wolt",
      "date": "2025-06-12T12:46:12.000Z",
      "title": "Your order’s delivered: KFC Kópavogi 12.06.2025",
      "amountISK": null,
      "category": "Wolt",
      "raw": {
        "from": "\"Wolt\" <info@wolt.com>",
        "subject": "Your order’s delivered: KFC Kópavogi 12.06.2025",
        "date": "2025-06-12T12:46:12.000Z",
        "amountISK": null,
        "preview": "Thanks for ordering, Arnar! Here's your receipt: KFC Kópavogi June 12, 2025, 12:44 Order ID: 684ac740db372d1110deadb9 Total ISK&nbsp; ‎4.075 ****3700 ‎4.075 Your order documents are attached to this email. If you have any questions, please contact support. We care about your opinion! Let us know about it by clicking here and filling out this survey! -->"
      }
    },
    {
      "id": "wolt-61",
      "kind": "receipt",
      "source": "gmail_wolt",
      "vendor": "Wolt",
      "date": "2025-06-15T22:17:38.000Z",
      "title": "Your order’s delivered: Ísbúðin Garðabæ 15.06.2025",
      "amountISK": null,
      "category": "Wolt",
      "raw": {
        "from": "\"Wolt\" <info@wolt.com>",
        "subject": "Your order’s delivered: Ísbúðin Garðabæ 15.06.2025",
        "date": "2025-06-15T22:17:38.000Z",
        "amountISK": null,
        "preview": "Thanks for ordering, Arnar! Here's your receipt: Ísbúðin Garðabæ June 15, 2025, 22:16 Order ID: 684f43e4445cc60904f21425 Total ISK&nbsp; ‎3.499 ****3700 ‎3.499 Your order documents are attached to this email. If you have any questions, please contact support. We care about your opinion! Let us know about it by clicking here and filling out this survey! -->"
      }
    },
    {
      "id": "wolt-62",
      "kind": "receipt",
      "source": "gmail_wolt",
      "vendor": "Wolt",
      "date": "2025-07-07T18:17:17.000Z",
      "title": "Your order’s delivered: KFC Kópavogi 07.07.2025",
      "amountISK": null,
      "category": "Wolt",
      "raw": {
        "from": "\"Wolt\" <info@wolt.com>",
        "subject": "Your order’s delivered: KFC Kópavogi 07.07.2025",
        "date": "2025-07-07T18:17:17.000Z",
        "amountISK": null,
        "preview": "Thanks for ordering, Arnar! Here's your receipt: KFC Kópavogi July 07, 2025, 18:08 Order ID: 686c077155498e553d3c6752 Total ISK&nbsp; ‎3.831 ****3700 ‎3.831 Your order documents are attached to this email. If you have any questions, please contact support. We care about your opinion! Let us know about it by clicking here and filling out this survey! -->"
      }
    },
    {
      "id": "wolt-63",
      "kind": "receipt",
      "source": "gmail_wolt",
      "vendor": "Wolt",
      "date": "2025-08-16T16:08:34.000Z",
      "title": "Your order’s delivered: KFC Kópavogi 16.08.2025",
      "amountISK": null,
      "category": "Wolt",
      "raw": {
        "from": "\"Wolt\" <info@wolt.com>",
        "subject": "Your order’s delivered: KFC Kópavogi 16.08.2025",
        "date": "2025-08-16T16:08:34.000Z",
        "amountISK": null,
        "preview": "Thanks for ordering, Arnar! Here's your receipt: KFC Kópavogi August 16, 2025, 16:07 Order ID: 68a0a9103bb87d5cb77127b7 Total ISK&nbsp; ‎3.981 ****3700 ‎3.981 Your order documents are attached to this email. If you have any questions, please contact support. We care about your opinion! Let us know about it by clicking here and filling out this survey! -->"
      }
    },
    {
      "id": "wolt-64",
      "kind": "receipt",
      "source": "gmail_wolt",
      "vendor": "Wolt",
      "date": "2025-08-17T15:19:48.000Z",
      "title": "Your order’s delivered: KFC Kópavogi 17.08.2025",
      "amountISK": null,
      "category": "Wolt",
      "raw": {
        "from": "\"Wolt\" <info@wolt.com>",
        "subject": "Your order’s delivered: KFC Kópavogi 17.08.2025",
        "date": "2025-08-17T15:19:48.000Z",
        "amountISK": null,
        "preview": "Thanks for ordering, Arnar! Here's your receipt: KFC Kópavogi August 17, 2025, 15:18 Order ID: 68a1ec8dd049ff311a978627 Total ISK&nbsp; ‎3.981 ****3700 ‎3.981 Your order documents are attached to this email. If you have any questions, please contact support. We care about your opinion! Let us know about it by clicking here and filling out this survey! -->"
      }
    },
    {
      "id": "wolt-65",
      "kind": "receipt",
      "source": "gmail_wolt",
      "vendor": "Wolt",
      "date": "2025-08-17T16:51:37.000Z",
      "title": "Your order’s delivered: King Kong Kópavogur 17.08.2025",
      "amountISK": null,
      "category": "Wolt",
      "raw": {
        "from": "\"Wolt\" <info@wolt.com>",
        "subject": "Your order’s delivered: King Kong Kópavogur 17.08.2025",
        "date": "2025-08-17T16:51:37.000Z",
        "amountISK": null,
        "preview": "Thanks for ordering, Arnar! Here's your receipt: King Kong Kópavogur August 17, 2025, 16:48 Order ID: 68a2005de19c8ac82b5021e3 Total ISK&nbsp; ‎7.639 ****3700 ‎7.639 Your order documents are attached to this email. If you have any questions, please contact support. We care about your opinion! Let us know about it by clicking here and filling out this survey! -->"
      }
    },
    {
      "id": "wolt-66",
      "kind": "receipt",
      "source": "gmail_wolt",
      "vendor": "Wolt",
      "date": "2025-09-01T12:52:26.000Z",
      "title": "Your order’s delivered: KFC Faxafeni 01.09.2025",
      "amountISK": null,
      "category": "Wolt",
      "raw": {
        "from": "\"Wolt\" <info@wolt.com>",
        "subject": "Your order’s delivered: KFC Faxafeni 01.09.2025",
        "date": "2025-09-01T12:52:26.000Z",
        "amountISK": null,
        "preview": "Thanks for ordering, Arnar! Here's your receipt: KFC Faxafeni September 01, 2025, 12:50 Order ID: 68b5922e1e7387d97834eae3 Total ISK&nbsp; ‎7.914 ****3700 ‎7.914 Your order documents are attached to this email. If you have any questions, please contact support. We care about your opinion! Let us know about it by clicking here and filling out this survey! -->"
      }
    },
    {
      "id": "wolt-67",
      "kind": "receipt",
      "source": "gmail_wolt",
      "vendor": "Wolt",
      "date": "2025-09-02T12:57:08.000Z",
      "title": "Your order’s delivered: KFC Faxafeni 02.09.2025",
      "amountISK": null,
      "category": "Wolt",
      "raw": {
        "from": "\"Wolt\" <info@wolt.com>",
        "subject": "Your order’s delivered: KFC Faxafeni 02.09.2025",
        "date": "2025-09-02T12:57:08.000Z",
        "amountISK": null,
        "preview": "Thanks for ordering, Arnar! Here's your receipt: KFC Faxafeni September 02, 2025, 12:56 Order ID: 68b6e0efda645e59f3ce85eb Total ISK&nbsp; ‎4.033 ****3700 ‎4.033 Your order documents are attached to this email. If you have any questions, please contact support. We care about your opinion! Let us know about it by clicking here and filling out this survey! -->"
      }
    },
    {
      "id": "wolt-68",
      "kind": "receipt",
      "source": "gmail_wolt",
      "vendor": "Wolt",
      "date": "2025-09-08T17:26:25.000Z",
      "title": "Your order’s delivered: KFC Faxafeni 08.09.2025",
      "amountISK": null,
      "category": "Wolt",
      "raw": {
        "from": "\"Wolt\" <info@wolt.com>",
        "subject": "Your order’s delivered: KFC Faxafeni 08.09.2025",
        "date": "2025-09-08T17:26:25.000Z",
        "amountISK": null,
        "preview": "Thanks for ordering, Arnar! Here's your receipt: KFC Faxafeni September 08, 2025, 17:22 Order ID: 68bf03d77d5bc7685154b962 Total ISK&nbsp; ‎4.033 ****3700 ‎4.033 Your order documents are attached to this email. If you have any questions, please contact support. We care about your opinion! Let us know about it by clicking here and filling out this survey! -->"
      }
    },
    {
      "id": "wolt-69",
      "kind": "receipt",
      "source": "gmail_wolt",
      "vendor": "Wolt",
      "date": "2025-09-10T17:02:20.000Z",
      "title": "Your order’s delivered: Hlöllabátar Bústaðarvegi 10.09.2025",
      "amountISK": null,
      "category": "Wolt",
      "raw": {
        "from": "\"Wolt\" <info@wolt.com>",
        "subject": "Your order’s delivered: Hlöllabátar Bústaðarvegi 10.09.2025",
        "date": "2025-09-10T17:02:20.000Z",
        "amountISK": null,
        "preview": "Thanks for ordering, Arnar! Here's your receipt: Hlöllabátar Bústaðarvegi September 10, 2025, 16:53 Order ID: 68c1a88e9c4bf1b75948e47b Total ISK&nbsp; ‎3.057 ****3700 ‎3.057 Your order documents are attached to this email. If you have any questions, please contact support. We care about your opinion! Let us know about it by clicking here and filling out this survey! -->"
      }
    },
    {
      "id": "wolt-70",
      "kind": "receipt",
      "source": "gmail_wolt",
      "vendor": "Wolt",
      "date": "2025-09-13T16:59:21.000Z",
      "title": "Your order’s delivered: King Kong Kópavogur 13.09.2025",
      "amountISK": null,
      "category": "Wolt",
      "raw": {
        "from": "\"Wolt\" <info@wolt.com>",
        "subject": "Your order’s delivered: King Kong Kópavogur 13.09.2025",
        "date": "2025-09-13T16:59:21.000Z",
        "amountISK": null,
        "preview": "Thanks for ordering, Arnar! Here's your receipt: King Kong Kópavogur September 13, 2025, 16:57 Order ID: 68c59e4ba9ebabb3598f7fef Total ISK&nbsp; ‎7.339 ****3700 ‎7.339 Your order documents are attached to this email. If you have any questions, please contact support. We care about your opinion! Let us know about it by clicking here and filling out this survey! -->"
      }
    },
    {
      "id": "wolt-71",
      "kind": "receipt",
      "source": "gmail_wolt",
      "vendor": "Wolt",
      "date": "2025-09-15T16:40:48.000Z",
      "title": "Your order’s delivered: KFC Faxafeni 15.09.2025",
      "amountISK": null,
      "category": "Wolt",
      "raw": {
        "from": "\"Wolt\" <info@wolt.com>",
        "subject": "Your order’s delivered: KFC Faxafeni 15.09.2025",
        "date": "2025-09-15T16:40:48.000Z",
        "amountISK": null,
        "preview": "Thanks for ordering, Arnar! Here's your receipt: KFC Faxafeni September 15, 2025, 16:39 Order ID: 68c83d9d301a056bd3ccc6e0 Total ISK&nbsp; ‎3.733 ****3700 ‎3.733 Your order documents are attached to this email. If you have any questions, please contact support. We care about your opinion! Let us know about it by clicking here and filling out this survey! -->"
      }
    },
    {
      "id": "wolt-72",
      "kind": "receipt",
      "source": "gmail_wolt",
      "vendor": "Wolt",
      "date": "2025-09-15T16:49:22.000Z",
      "title": "Tip Receipt",
      "amountISK": null,
      "category": "Wolt",
      "raw": {
        "from": "\"Wolt\" <info@wolt.com>",
        "subject": "Tip Receipt",
        "date": "2025-09-15T16:49:22.000Z",
        "amountISK": null,
        "preview": "Thanks for the tip, Arnar Here's your receipt: Courier Partner Tip September 15, 2025, 16:39 Order ID: 68c83d9d301a056bd3ccc6e0 Total ISK&nbsp; ‎300 4633 72** **** 3700 ‎300 Your order documents are attached to this email. If you have any questions, please contact support. We care about your opinion! Let us know about it by clicking here and filling out this survey! -->"
      }
    },
    {
      "id": "wolt-73",
      "kind": "receipt",
      "source": "gmail_wolt",
      "vendor": "Wolt",
      "date": "2025-09-19T20:35:09.000Z",
      "title": "Your order’s delivered: King Kong Kópavogur 19.09.2025",
      "amountISK": null,
      "category": "Wolt",
      "raw": {
        "from": "\"Wolt\" <info@wolt.com>",
        "subject": "Your order’s delivered: King Kong Kópavogur 19.09.2025",
        "date": "2025-09-19T20:35:09.000Z",
        "amountISK": null,
        "preview": "Thanks for ordering, Arnar! Here's your receipt: King Kong Kópavogur September 19, 2025, 20:07 Order ID: 68cdb5001a9f2e7364a0f54f Total ISK&nbsp; ‎7.339 ****3700 ‎7.339 Your order documents are attached to this email. If you have any questions, please contact support. We care about your opinion! Let us know about it by clicking here and filling out this survey! -->"
      }
    },
    {
      "id": "wolt-74",
      "kind": "receipt",
      "source": "gmail_wolt",
      "vendor": "Wolt",
      "date": "2025-09-28T19:47:37.000Z",
      "title": "Your order’s delivered: KFC Kópavogi 28.09.2025",
      "amountISK": null,
      "category": "Wolt",
      "raw": {
        "from": "\"Wolt\" <info@wolt.com>",
        "subject": "Your order’s delivered: KFC Kópavogi 28.09.2025",
        "date": "2025-09-28T19:47:37.000Z",
        "amountISK": null,
        "preview": "Thanks for ordering, Arnar! Here's your receipt: KFC Kópavogi September 28, 2025, 19:28 Order ID: 68d984cd7c1c9eca80539e49 Total ISK&nbsp; ‎4.033 ****3700 ‎4.033 Your order documents are attached to this email. If you have any questions, please contact support. We care about your opinion! Let us know about it by clicking here and filling out this survey! -->"
      }
    },
    {
      "id": "wolt-75",
      "kind": "receipt",
      "source": "gmail_wolt",
      "vendor": "Wolt",
      "date": "2025-10-08T16:52:19.000Z",
      "title": "Your order’s delivered: KFC Faxafeni 08.10.2025",
      "amountISK": null,
      "category": "Wolt",
      "raw": {
        "from": "\"Wolt\" <info@wolt.com>",
        "subject": "Your order’s delivered: KFC Faxafeni 08.10.2025",
        "date": "2025-10-08T16:52:19.000Z",
        "amountISK": null,
        "preview": "Thanks for ordering, Arnar! Here's your receipt: KFC Faxafeni October 08, 2025, 16:43 Order ID: 68e690fa30e74b29aa398772 Total ISK&nbsp; ‎3.530 ****3700 ‎2.063 Credits ‎1.467 Your order documents are attached to this email. If you have any questions, please contact support. We care about your opinion! Let us know about it by clicking here and filling out this survey! -->"
      }
    },
    {
      "id": "wolt-76",
      "kind": "receipt",
      "source": "gmail_wolt",
      "vendor": "Wolt",
      "date": "2025-10-16T17:26:34.000Z",
      "title": "Your order’s delivered: KFC Faxafeni 16.10.2025",
      "amountISK": null,
      "category": "Wolt",
      "raw": {
        "from": "\"Wolt\" <info@wolt.com>",
        "subject": "Your order’s delivered: KFC Faxafeni 16.10.2025",
        "date": "2025-10-16T17:26:34.000Z",
        "amountISK": null,
        "preview": "Thanks for ordering, Arnar! Here's your receipt: KFC Faxafeni October 16, 2025, 17:07 Order ID: 68f1204fdaab1363729d269d Total ISK&nbsp; ‎5.457 ****3700 ‎5.457 Your order documents are attached to this email. If you have any questions, please contact support. We care about your opinion! Let us know about it by clicking here and filling out this survey! -->"
      }
    },
    {
      "id": "wolt-77",
      "kind": "receipt",
      "source": "gmail_wolt",
      "vendor": "Wolt",
      "date": "2025-11-27T13:13:03.000Z",
      "title": "Your order’s delivered: King Kong Kópavogur 27.11.2025",
      "amountISK": null,
      "category": "Wolt",
      "raw": {
        "from": "\"Wolt\" <info@wolt.com>",
        "subject": "Your order’s delivered: King Kong Kópavogur 27.11.2025",
        "date": "2025-11-27T13:13:03.000Z",
        "amountISK": null,
        "preview": "Thanks for ordering, Arnar! Here's your receipt: King Kong Kópavogur November 27, 2025, 13:12 Order ID: 692849e5329ad5a279c3309e Total ISK&nbsp; ‎5.503 ****1278 ‎5.503 Your order documents are attached to this email. If you have any questions, please contact support. We care about your opinion! Let us know about it by clicking here and filling out this survey! -->"
      }
    },
    {
      "id": "wolt-78",
      "kind": "receipt",
      "source": "gmail_wolt",
      "vendor": "Wolt",
      "date": "2025-11-27T13:33:04.000Z",
      "title": "Tip Receipt",
      "amountISK": null,
      "category": "Wolt",
      "raw": {
        "from": "\"Wolt\" <info@wolt.com>",
        "subject": "Tip Receipt",
        "date": "2025-11-27T13:33:04.000Z",
        "amountISK": null,
        "preview": "Thanks for the tip, Arnar Here's your receipt: Courier Partner Tip November 27, 2025, 13:12 Order ID: 692849e5329ad5a279c3309e Total ISK&nbsp; ‎300 4633 72** **** 1278 ‎300 Your order documents are attached to this email. If you have any questions, please contact support. We care about your opinion! Let us know about it by clicking here and filling out this survey! -->"
      }
    },
    {
      "id": "wolt-79",
      "kind": "receipt",
      "source": "gmail_wolt",
      "vendor": "Wolt",
      "date": "2025-11-27T22:00:36.000Z",
      "title": "Your order’s delivered: Ísbúðin Garðabæ 27.11.2025",
      "amountISK": null,
      "category": "Wolt",
      "raw": {
        "from": "\"Wolt\" <info@wolt.com>",
        "subject": "Your order’s delivered: Ísbúðin Garðabæ 27.11.2025",
        "date": "2025-11-27T22:00:36.000Z",
        "amountISK": null,
        "preview": "Thanks for ordering, Arnar! Here's your receipt: Ísbúðin Garðabæ November 27, 2025, 21:59 Order ID: 6928c45dc417f28210960f67 Total ISK&nbsp; ‎3.457 ****1278 ‎3.457 Your order documents are attached to this email. If you have any questions, please contact support. We care about your opinion! Let us know about it by clicking here and filling out this survey! -->"
      }
    },
    {
      "id": "wolt-80",
      "kind": "receipt",
      "source": "gmail_wolt",
      "vendor": "Wolt",
      "date": "2025-11-30T19:52:42.000Z",
      "title": "Your order’s delivered: Ísbúðin Garðabæ 30.11.2025",
      "amountISK": null,
      "category": "Wolt",
      "raw": {
        "from": "\"Wolt\" <info@wolt.com>",
        "subject": "Your order’s delivered: Ísbúðin Garðabæ 30.11.2025",
        "date": "2025-11-30T19:52:42.000Z",
        "amountISK": null,
        "preview": "Thanks for ordering, Arnar! Here's your receipt: Ísbúðin Garðabæ November 30, 2025, 19:51 Order ID: 692c9d8ed85d44e9be27c518 Total ISK&nbsp; ‎3.607 ****1278 ‎3.607 Your order documents are attached to this email. If you have any questions, please contact support. We care about your opinion! Let us know about it by clicking here and filling out this survey! -->"
      }
    },
    {
      "id": "wolt-81",
      "kind": "receipt",
      "source": "gmail_wolt",
      "vendor": "Wolt",
      "date": "2025-12-25T20:46:03.000Z",
      "title": "Your order’s delivered: King Kong Reykjavík 25.12.2025",
      "amountISK": null,
      "category": "Wolt",
      "raw": {
        "from": "\"Wolt\" <info@wolt.com>",
        "subject": "Your order’s delivered: King Kong Reykjavík 25.12.2025",
        "date": "2025-12-25T20:46:03.000Z",
        "amountISK": null,
        "preview": "Thanks for ordering, Arnar! Here's your receipt: King Kong Reykjavík December 25, 2025, 20:44 Order ID: 694d97148ca8e9311ca9a6bd Total ISK&nbsp; ‎4.290 ****1278 ‎4.290 Your order documents are attached to this email. If you have any questions, please contact support. We care about your opinion! Let us know about it by clicking here and filling out this survey! -->"
      }
    },
    {
      "id": "wolt-82",
      "kind": "receipt",
      "source": "gmail_wolt",
      "vendor": "Wolt",
      "date": "2025-12-28T17:12:06.000Z",
      "title": "Your order’s delivered: King Kong Reykjavík 28.12.2025",
      "amountISK": null,
      "category": "Wolt",
      "raw": {
        "from": "\"Wolt\" <info@wolt.com>",
        "subject": "Your order’s delivered: King Kong Reykjavík 28.12.2025",
        "date": "2025-12-28T17:12:06.000Z",
        "amountISK": null,
        "preview": "Thanks for ordering, Arnar! Here's your receipt: King Kong Reykjavík December 28, 2025, 17:10 Order ID: 6951573bacb1ed752d872726 Total ISK&nbsp; ‎6.203 ****1278 ‎6.203 Your order documents are attached to this email. If you have any questions, please contact support. We care about your opinion! Let us know about it by clicking here and filling out this survey! -->"
      }
    },
    {
      "id": "wolt-83",
      "kind": "receipt",
      "source": "gmail_wolt",
      "vendor": "Wolt",
      "date": "2026-01-03T16:23:26.000Z",
      "title": "Your order’s delivered: Dínó Sjoppa 03.01.2026",
      "amountISK": null,
      "category": "Wolt",
      "raw": {
        "from": "\"Wolt\" <info@wolt.com>",
        "subject": "Your order’s delivered: Dínó Sjoppa 03.01.2026",
        "date": "2026-01-03T16:23:26.000Z",
        "amountISK": null,
        "preview": "Thanks for ordering, Arnar! Here's your receipt: Dínó Sjoppa January 03, 2026, 16:22 Order ID: 695937aed7b2126e003c0241 Total ISK&nbsp; ‎7.028 ****1278 ‎7.028 Your order documents are attached to this email. If you have any questions, please contact support. We care about your opinion! Let us know about it by clicking here and filling out this survey! -->"
      }
    },
    {
      "id": "wolt-84",
      "kind": "receipt",
      "source": "gmail_wolt",
      "vendor": "Wolt",
      "date": "2026-01-24T22:09:58.000Z",
      "title": "Your order’s delivered: Ísbúðin Garðabæ 24.01.2026",
      "amountISK": null,
      "category": "Wolt",
      "raw": {
        "from": "\"Wolt\" <info@wolt.com>",
        "subject": "Your order’s delivered: Ísbúðin Garðabæ 24.01.2026",
        "date": "2026-01-24T22:09:58.000Z",
        "amountISK": null,
        "preview": "Thanks for ordering, Arnar! Here's your receipt: Ísbúðin Garðabæ January 24, 2026, 22:08 Order ID: 69753f8f3b143c1c74e82772 Total ISK&nbsp; ‎3.607 ****1278 ‎3.607 Your order documents are attached to this email. If you have any questions, please contact support. We care about your opinion! Let us know about it by clicking here and filling out this survey! -->"
      }
    }
  ],
  "transactions": [
    {
      "id": "indo-3",
      "kind": "bank_tx",
      "source": "indo",
      "date": "2026-02-02T00:00:00.000Z",
      "title": "CLAUDE.AI SUBSCRIPTION",
      "amountISK": -12220,
      "category": "Áskrift",
      "raw": {
        "booking_date": "2026-02-02 0:0:0",
        "transaction_at": "2026-01-31 13:47:26",
        "transaction_type": "card_payment",
        "counterparty_id": "Q0RRUWQV26H30SO",
        "merchant_city": "ANTHROPIC.COM",
        "merchant_country_code": "USA",
        "merchant_category_code": "5734"
      }
    },
    {
      "id": "indo-4",
      "kind": "bank_tx",
      "source": "indo",
      "date": "2026-02-02T00:00:00.000Z",
      "title": "Wolt.com",
      "amountISK": -4850,
      "category": "Wolt",
      "raw": {
        "booking_date": "2026-02-02 0:0:0",
        "transaction_at": "2026-01-31 17:4:46",
        "transaction_type": "card_payment",
        "counterparty_id": "100000000022542",
        "merchant_city": "Finland",
        "merchant_country_code": "ISL",
        "merchant_category_code": "5812"
      }
    },
    {
      "id": "indo-5",
      "kind": "bank_tx",
      "source": "indo",
      "date": "2026-02-02T00:00:00.000Z",
      "title": "HAGKAUP GARDABAER",
      "amountISK": -1714,
      "category": "Hagkaup",
      "raw": {
        "booking_date": "2026-02-02 0:0:0",
        "transaction_at": "2026-01-31 20:8:53",
        "transaction_type": "card_payment",
        "counterparty_id": "000000000001748",
        "merchant_city": "GARDABAER",
        "merchant_country_code": "ISL",
        "merchant_category_code": "5411"
      }
    },
    {
      "id": "indo-6",
      "kind": "bank_tx",
      "source": "indo",
      "date": "2026-02-02T00:00:00.000Z",
      "title": "ISBUDIN GARDABAE",
      "amountISK": -2100,
      "category": "Matur - Úti",
      "raw": {
        "booking_date": "2026-02-02 0:0:0",
        "transaction_at": "2026-01-31 20:15:14",
        "transaction_type": "card_payment",
        "counterparty_id": "8047346",
        "merchant_city": "GARDABAE",
        "merchant_country_code": "ISL",
        "merchant_category_code": "5814"
      }
    },
    {
      "id": "indo-7",
      "kind": "bank_tx",
      "source": "indo",
      "date": "2026-02-02T00:00:00.000Z",
      "title": "Arnar Kjartansson",
      "amountISK": 4000,
      "category": "Annað",
      "raw": {
        "booking_date": "2026-02-02 0:0:0",
        "transaction_at": "2026-01-31 20:8:46",
        "transaction_type": "credit_transfer",
        "counterparty_id": "1412922269",
        "merchant_city": null,
        "merchant_country_code": null,
        "merchant_category_code": null
      }
    },
    {
      "id": "indo-8",
      "kind": "bank_tx",
      "source": "indo",
      "date": "2026-02-02T00:00:00.000Z",
      "title": "Arnar Kjartansson",
      "amountISK": 5000,
      "category": "Annað",
      "raw": {
        "booking_date": "2026-02-02 0:0:0",
        "transaction_at": "2026-01-31 17:4:27",
        "transaction_type": "credit_transfer",
        "counterparty_id": "1412922269",
        "merchant_city": null,
        "merchant_country_code": null,
        "merchant_category_code": null
      }
    },
    {
      "id": "indo-9",
      "kind": "bank_tx",
      "source": "indo",
      "date": "2026-02-02T00:00:00.000Z",
      "title": "Arnar Kjartansson",
      "amountISK": 13000,
      "category": "Annað",
      "raw": {
        "booking_date": "2026-02-02 0:0:0",
        "transaction_at": "2026-01-31 13:47:1",
        "transaction_type": "credit_transfer",
        "counterparty_id": "1412922269",
        "merchant_city": null,
        "merchant_country_code": null,
        "merchant_category_code": null
      }
    },
    {
      "id": "indo-10",
      "kind": "bank_tx",
      "source": "indo",
      "date": "2026-02-02T00:00:00.000Z",
      "title": "HAGKAUP GARDABAER",
      "amountISK": -11562,
      "category": "Hagkaup",
      "raw": {
        "booking_date": "2026-02-02 0:0:0",
        "transaction_at": "2026-01-30 17:52:34",
        "transaction_type": "card_payment",
        "counterparty_id": "000000000001748",
        "merchant_city": "GARDABAER",
        "merchant_country_code": "ISL",
        "merchant_category_code": "5411"
      }
    },
    {
      "id": "indo-11",
      "kind": "bank_tx",
      "source": "indo",
      "date": "2026-01-30T00:00:00.000Z",
      "title": "Vextir",
      "amountISK": 1,
      "category": "Annað",
      "raw": {
        "booking_date": "2026-01-30 0:0:0",
        "transaction_at": "2026-01-30 21:5:31",
        "transaction_type": "interest",
        "counterparty_id": "4110180400",
        "merchant_city": null,
        "merchant_country_code": null,
        "merchant_category_code": null
      }
    },
    {
      "id": "indo-12",
      "kind": "bank_tx",
      "source": "indo",
      "date": "2026-01-30T00:00:00.000Z",
      "title": "Vaxtaleiðrétting",
      "amountISK": -34,
      "category": "Annað",
      "raw": {
        "booking_date": "2026-01-30 0:0:0",
        "transaction_at": "2026-01-30 21:5:31",
        "transaction_type": "interest_correction",
        "counterparty_id": "4110180400",
        "merchant_city": null,
        "merchant_country_code": null,
        "merchant_category_code": null
      }
    },
    {
      "id": "indo-13",
      "kind": "bank_tx",
      "source": "indo",
      "date": "2026-01-30T00:00:00.000Z",
      "title": "Arnar Kjartansson",
      "amountISK": 12000,
      "category": "Annað",
      "raw": {
        "booking_date": "2026-01-30 0:0:0",
        "transaction_at": "2026-01-30 17:52:27",
        "transaction_type": "credit_transfer",
        "counterparty_id": "1412922269",
        "merchant_city": null,
        "merchant_country_code": null,
        "merchant_category_code": null
      }
    },
    {
      "id": "indo-14",
      "kind": "bank_tx",
      "source": "indo",
      "date": "2026-01-30T00:00:00.000Z",
      "title": "HAGKAUP GARDABAER",
      "amountISK": -2134,
      "category": "Hagkaup",
      "raw": {
        "booking_date": "2026-01-30 0:0:0",
        "transaction_at": "2026-01-29 22:8:21",
        "transaction_type": "card_payment",
        "counterparty_id": "000000000001748",
        "merchant_city": "GARDABAER",
        "merchant_country_code": "ISL",
        "merchant_category_code": "5411"
      }
    },
    {
      "id": "indo-15",
      "kind": "bank_tx",
      "source": "indo",
      "date": "2026-01-30T00:00:00.000Z",
      "title": "Arnar Kjartansson",
      "amountISK": -526021,
      "category": "Annað",
      "raw": {
        "booking_date": "2026-01-30 0:0:0",
        "transaction_at": "2026-01-30 9:0:27",
        "transaction_type": "credit_transfer",
        "counterparty_id": "1412922269",
        "merchant_city": null,
        "merchant_country_code": null,
        "merchant_category_code": null
      }
    },
    {
      "id": "indo-16",
      "kind": "bank_tx",
      "source": "indo",
      "date": "2026-01-30T00:00:00.000Z",
      "title": "Takk ehf.",
      "amountISK": 525568,
      "category": "Annað",
      "raw": {
        "booking_date": "2026-01-30 0:0:0",
        "transaction_at": "2026-01-30 4:54:31",
        "transaction_type": "credit_transfer",
        "counterparty_id": "6301230970",
        "merchant_city": null,
        "merchant_country_code": null,
        "merchant_category_code": null
      }
    },
    {
      "id": "indo-17",
      "kind": "bank_tx",
      "source": "indo",
      "date": "2026-01-29T00:00:00.000Z",
      "title": "Arnar Kjartansson",
      "amountISK": 2500,
      "category": "Annað",
      "raw": {
        "booking_date": "2026-01-29 0:0:0",
        "transaction_at": "2026-01-29 22:8:16",
        "transaction_type": "credit_transfer",
        "counterparty_id": "1412922269",
        "merchant_city": null,
        "merchant_country_code": null,
        "merchant_category_code": null
      }
    },
    {
      "id": "indo-18",
      "kind": "bank_tx",
      "source": "indo",
      "date": "2026-01-29T00:00:00.000Z",
      "title": "HAGKAUP GARDABAER",
      "amountISK": -2144,
      "category": "Hagkaup",
      "raw": {
        "booking_date": "2026-01-29 0:0:0",
        "transaction_at": "2026-01-28 19:13:27",
        "transaction_type": "card_payment",
        "counterparty_id": "000000000001748",
        "merchant_city": "GARDABAER",
        "merchant_country_code": "ISL",
        "merchant_category_code": "5411"
      }
    },
    {
      "id": "indo-19",
      "kind": "bank_tx",
      "source": "indo",
      "date": "2026-01-29T00:00:00.000Z",
      "title": "STR*Apotek Gardabaejar",
      "amountISK": -1261,
      "category": "Annað",
      "raw": {
        "booking_date": "2026-01-29 0:0:0",
        "transaction_at": "2026-01-28 13:52:56",
        "transaction_type": "card_payment",
        "counterparty_id": "498750040224790",
        "merchant_city": "GARDhABAeR",
        "merchant_country_code": "ISL",
        "merchant_category_code": "5912"
      }
    },
    {
      "id": "indo-20",
      "kind": "bank_tx",
      "source": "indo",
      "date": "2026-01-28T00:00:00.000Z",
      "title": "Arnar Kjartansson",
      "amountISK": 2144,
      "category": "Annað",
      "raw": {
        "booking_date": "2026-01-28 0:0:0",
        "transaction_at": "2026-01-28 19:13:21",
        "transaction_type": "credit_transfer",
        "counterparty_id": "1412922269",
        "merchant_city": null,
        "merchant_country_code": null,
        "merchant_category_code": null
      }
    },
    {
      "id": "indo-21",
      "kind": "bank_tx",
      "source": "indo",
      "date": "2026-01-28T00:00:00.000Z",
      "title": "Arnar Kjartansson",
      "amountISK": 1261,
      "category": "Annað",
      "raw": {
        "booking_date": "2026-01-28 0:0:0",
        "transaction_at": "2026-01-28 13:52:53",
        "transaction_type": "credit_transfer",
        "counterparty_id": "1412922269",
        "merchant_city": null,
        "merchant_country_code": null,
        "merchant_category_code": null
      }
    },
    {
      "id": "indo-22",
      "kind": "bank_tx",
      "source": "indo",
      "date": "2026-01-28T00:00:00.000Z",
      "title": "HAGKAUP GARDABAER",
      "amountISK": -2593,
      "category": "Hagkaup",
      "raw": {
        "booking_date": "2026-01-28 0:0:0",
        "transaction_at": "2026-01-27 19:37:41",
        "transaction_type": "card_payment",
        "counterparty_id": "000000000001748",
        "merchant_city": "GARDABAER",
        "merchant_country_code": "ISL",
        "merchant_category_code": "5411"
      }
    },
    {
      "id": "indo-23",
      "kind": "bank_tx",
      "source": "indo",
      "date": "2026-01-28T00:00:00.000Z",
      "title": "MOJ MARKET II EHF.",
      "amountISK": -399,
      "category": "Matur - Innkaup",
      "raw": {
        "booking_date": "2026-01-28 0:0:0",
        "transaction_at": "2026-01-27 14:38:59",
        "transaction_type": "card_payment",
        "counterparty_id": "000000000004141",
        "merchant_city": "REYKJAVIK",
        "merchant_country_code": "ISL",
        "merchant_category_code": "5411"
      }
    },
    {
      "id": "indo-24",
      "kind": "bank_tx",
      "source": "indo",
      "date": "2026-01-27T00:00:00.000Z",
      "title": "Arnar Kjartansson",
      "amountISK": 2593,
      "category": "Annað",
      "raw": {
        "booking_date": "2026-01-27 0:0:0",
        "transaction_at": "2026-01-27 19:37:31",
        "transaction_type": "credit_transfer",
        "counterparty_id": "1412922269",
        "merchant_city": null,
        "merchant_country_code": null,
        "merchant_category_code": null
      }
    },
    {
      "id": "indo-25",
      "kind": "bank_tx",
      "source": "indo",
      "date": "2026-01-27T00:00:00.000Z",
      "title": "HAGKAUP GARDABAER",
      "amountISK": -2553,
      "category": "Hagkaup",
      "raw": {
        "booking_date": "2026-01-27 0:0:0",
        "transaction_at": "2026-01-26 18:38:21",
        "transaction_type": "card_payment",
        "counterparty_id": "000000000001748",
        "merchant_city": "GARDABAER",
        "merchant_country_code": "ISL",
        "merchant_category_code": "5411"
      }
    },
    {
      "id": "indo-26",
      "kind": "bank_tx",
      "source": "indo",
      "date": "2026-01-27T00:00:00.000Z",
      "title": "Arion ATM 036158",
      "amountISK": -20295,
      "category": "Annað",
      "raw": {
        "booking_date": "2026-01-27 0:0:0",
        "transaction_at": "2026-01-26 18:39:23",
        "transaction_type": "card_payment",
        "counterparty_id": "07755030361HO58",
        "merchant_city": "GARDABAER",
        "merchant_country_code": "ISL",
        "merchant_category_code": "6011"
      }
    },
    {
      "id": "indo-27",
      "kind": "bank_tx",
      "source": "indo",
      "date": "2026-01-27T00:00:00.000Z",
      "title": "Blaa sjoppan",
      "amountISK": -5187,
      "category": "Annað",
      "raw": {
        "booking_date": "2026-01-27 0:0:0",
        "transaction_at": "2026-01-25 16:5:50",
        "transaction_type": "card_payment",
        "counterparty_id": "8032748",
        "merchant_city": "Reykjavik",
        "merchant_country_code": "ISL",
        "merchant_category_code": "5441"
      }
    },
    {
      "id": "indo-28",
      "kind": "bank_tx",
      "source": "indo",
      "date": "2026-01-26T00:00:00.000Z",
      "title": "Arnar Kjartansson",
      "amountISK": 23000,
      "category": "Annað",
      "raw": {
        "booking_date": "2026-01-26 0:0:0",
        "transaction_at": "2026-01-26 18:38:14",
        "transaction_type": "credit_transfer",
        "counterparty_id": "1412922269",
        "merchant_city": null,
        "merchant_country_code": null,
        "merchant_category_code": null
      }
    },
    {
      "id": "indo-29",
      "kind": "bank_tx",
      "source": "indo",
      "date": "2026-01-26T00:00:00.000Z",
      "title": "Orkan - Gardabaer EV",
      "amountISK": -739,
      "category": "Annað",
      "raw": {
        "booking_date": "2026-01-26 0:0:0",
        "transaction_at": "2026-01-25 14:8:42",
        "transaction_type": "card_payment",
        "counterparty_id": "351251321016355",
        "merchant_city": "Gardabaer",
        "merchant_country_code": "ISL",
        "merchant_category_code": "5542"
      }
    },
    {
      "id": "indo-30",
      "kind": "bank_tx",
      "source": "indo",
      "date": "2026-01-26T00:00:00.000Z",
      "title": "HAGKAUP GARDABAER",
      "amountISK": -6279,
      "category": "Hagkaup",
      "raw": {
        "booking_date": "2026-01-26 0:0:0",
        "transaction_at": "2026-01-25 19:22:4",
        "transaction_type": "card_payment",
        "counterparty_id": "000000000001748",
        "merchant_city": "GARDABAER",
        "merchant_country_code": "ISL",
        "merchant_category_code": "5411"
      }
    },
    {
      "id": "indo-31",
      "kind": "bank_tx",
      "source": "indo",
      "date": "2026-01-26T00:00:00.000Z",
      "title": "HAGKAUP GARDABAER",
      "amountISK": -4238,
      "category": "Hagkaup",
      "raw": {
        "booking_date": "2026-01-26 0:0:0",
        "transaction_at": "2026-01-25 13:36:19",
        "transaction_type": "card_payment",
        "counterparty_id": "000000000001748",
        "merchant_city": "GARDABAER",
        "merchant_country_code": "ISL",
        "merchant_category_code": "5411"
      }
    },
    {
      "id": "indo-32",
      "kind": "bank_tx",
      "source": "indo",
      "date": "2026-01-26T00:00:00.000Z",
      "title": "Arnar Kjartansson",
      "amountISK": 6300,
      "category": "Annað",
      "raw": {
        "booking_date": "2026-01-26 0:0:0",
        "transaction_at": "2026-01-25 19:21:55",
        "transaction_type": "credit_transfer",
        "counterparty_id": "1412922269",
        "merchant_city": null,
        "merchant_country_code": null,
        "merchant_category_code": null
      }
    },
    {
      "id": "indo-33",
      "kind": "bank_tx",
      "source": "indo",
      "date": "2026-01-26T00:00:00.000Z",
      "title": "Arnar Kjartansson",
      "amountISK": 500,
      "category": "Annað",
      "raw": {
        "booking_date": "2026-01-26 0:0:0",
        "transaction_at": "2026-01-25 16:5:45",
        "transaction_type": "credit_transfer",
        "counterparty_id": "1412922269",
        "merchant_city": null,
        "merchant_country_code": null,
        "merchant_category_code": null
      }
    },
    {
      "id": "indo-34",
      "kind": "bank_tx",
      "source": "indo",
      "date": "2026-01-26T00:00:00.000Z",
      "title": "Arnar Kjartansson",
      "amountISK": 5000,
      "category": "Annað",
      "raw": {
        "booking_date": "2026-01-26 0:0:0",
        "transaction_at": "2026-01-25 16:4:37",
        "transaction_type": "credit_transfer",
        "counterparty_id": "1412922269",
        "merchant_city": null,
        "merchant_country_code": null,
        "merchant_category_code": null
      }
    },
    {
      "id": "indo-35",
      "kind": "bank_tx",
      "source": "indo",
      "date": "2026-01-26T00:00:00.000Z",
      "title": "Arnar Kjartansson",
      "amountISK": -26123,
      "category": "Annað",
      "raw": {
        "booking_date": "2026-01-26 0:0:0",
        "transaction_at": "2026-01-25 16:4:23",
        "transaction_type": "credit_transfer",
        "counterparty_id": "1412922269",
        "merchant_city": null,
        "merchant_country_code": null,
        "merchant_category_code": null
      }
    },
    {
      "id": "indo-36",
      "kind": "bank_tx",
      "source": "indo",
      "date": "2026-01-26T00:00:00.000Z",
      "title": "indó sparisjóður hf.",
      "amountISK": 25000,
      "category": "Annað",
      "raw": {
        "booking_date": "2026-01-26 0:0:0",
        "transaction_at": "2026-01-25 16:4:9",
        "transaction_type": "credit_transfer",
        "counterparty_id": "4110180400",
        "merchant_city": null,
        "merchant_country_code": null,
        "merchant_category_code": null
      }
    },
    {
      "id": "indo-37",
      "kind": "bank_tx",
      "source": "indo",
      "date": "2026-01-26T00:00:00.000Z",
      "title": "Arnar Kjartansson",
      "amountISK": 5000,
      "category": "Annað",
      "raw": {
        "booking_date": "2026-01-26 0:0:0",
        "transaction_at": "2026-01-25 13:36:6",
        "transaction_type": "credit_transfer",
        "counterparty_id": "1412922269",
        "merchant_city": null,
        "merchant_country_code": null,
        "merchant_category_code": null
      }
    },
    {
      "id": "indo-38",
      "kind": "bank_tx",
      "source": "indo",
      "date": "2026-01-26T00:00:00.000Z",
      "title": "Arnar Kjartansson",
      "amountISK": 800,
      "category": "Annað",
      "raw": {
        "booking_date": "2026-01-26 0:0:0",
        "transaction_at": "2026-01-25 13:31:33",
        "transaction_type": "credit_transfer",
        "counterparty_id": "1412922269",
        "merchant_city": null,
        "merchant_country_code": null,
        "merchant_category_code": null
      }
    },
    {
      "id": "indo-39",
      "kind": "bank_tx",
      "source": "indo",
      "date": "2026-01-26T00:00:00.000Z",
      "title": "Wolt.com",
      "amountISK": -3607,
      "category": "Wolt",
      "raw": {
        "booking_date": "2026-01-26 0:0:0",
        "transaction_at": "2026-01-24 21:54:36",
        "transaction_type": "card_payment",
        "counterparty_id": "100000000022542",
        "merchant_city": "Finland",
        "merchant_country_code": "ISL",
        "merchant_category_code": "5812"
      }
    },
    {
      "id": "indo-40",
      "kind": "bank_tx",
      "source": "indo",
      "date": "2026-01-26T00:00:00.000Z",
      "title": "Arnar Kjartansson",
      "amountISK": 3800,
      "category": "Annað",
      "raw": {
        "booking_date": "2026-01-26 0:0:0",
        "transaction_at": "2026-01-24 21:54:16",
        "transaction_type": "credit_transfer",
        "counterparty_id": "1412922269",
        "merchant_city": null,
        "merchant_country_code": null,
        "merchant_category_code": null
      }
    },
    {
      "id": "indo-41",
      "kind": "bank_tx",
      "source": "indo",
      "date": "2026-01-26T00:00:00.000Z",
      "title": "HAGKAUP GARDABAER",
      "amountISK": -3584,
      "category": "Hagkaup",
      "raw": {
        "booking_date": "2026-01-26 0:0:0",
        "transaction_at": "2026-01-23 19:29:29",
        "transaction_type": "card_payment",
        "counterparty_id": "000000000001748",
        "merchant_city": "GARDABAER",
        "merchant_country_code": "ISL",
        "merchant_category_code": "5411"
      }
    },
    {
      "id": "indo-42",
      "kind": "bank_tx",
      "source": "indo",
      "date": "2026-01-23T00:00:00.000Z",
      "title": "Arnar Kjartansson",
      "amountISK": 3100,
      "category": "Annað",
      "raw": {
        "booking_date": "2026-01-23 0:0:0",
        "transaction_at": "2026-01-23 19:29:19",
        "transaction_type": "credit_transfer",
        "counterparty_id": "1412922269",
        "merchant_city": null,
        "merchant_country_code": null,
        "merchant_category_code": null
      }
    },
    {
      "id": "indo-43",
      "kind": "bank_tx",
      "source": "indo",
      "date": "2026-01-23T00:00:00.000Z",
      "title": "HAGKAUP GARDABAER",
      "amountISK": -3704,
      "category": "Hagkaup",
      "raw": {
        "booking_date": "2026-01-23 0:0:0",
        "transaction_at": "2026-01-22 18:10:48",
        "transaction_type": "card_payment",
        "counterparty_id": "000000000001748",
        "merchant_city": "GARDABAER",
        "merchant_country_code": "ISL",
        "merchant_category_code": "5411"
      }
    },
    {
      "id": "indo-44",
      "kind": "bank_tx",
      "source": "indo",
      "date": "2026-01-23T00:00:00.000Z",
      "title": "MOJ MARKET II EHF.",
      "amountISK": -798,
      "category": "Matur - Innkaup",
      "raw": {
        "booking_date": "2026-01-23 0:0:0",
        "transaction_at": "2026-01-22 14:51:46",
        "transaction_type": "card_payment",
        "counterparty_id": "000000000004141",
        "merchant_city": "REYKJAVIK",
        "merchant_country_code": "ISL",
        "merchant_category_code": "5411"
      }
    },
    {
      "id": "indo-45",
      "kind": "bank_tx",
      "source": "indo",
      "date": "2026-01-22T00:00:00.000Z",
      "title": "Arnar Kjartansson",
      "amountISK": 3500,
      "category": "Annað",
      "raw": {
        "booking_date": "2026-01-22 0:0:0",
        "transaction_at": "2026-01-22 18:10:39",
        "transaction_type": "credit_transfer",
        "counterparty_id": "1412922269",
        "merchant_city": null,
        "merchant_country_code": null,
        "merchant_category_code": null
      }
    },
    {
      "id": "indo-46",
      "kind": "bank_tx",
      "source": "indo",
      "date": "2026-01-22T00:00:00.000Z",
      "title": "Orkan - Laugavegi EV",
      "amountISK": -396,
      "category": "Annað",
      "raw": {
        "booking_date": "2026-01-22 0:0:0",
        "transaction_at": "2026-01-21 19:26:54",
        "transaction_type": "card_payment",
        "counterparty_id": "371765321110253",
        "merchant_city": "Reykjavik",
        "merchant_country_code": "ISL",
        "merchant_category_code": "5552"
      }
    },
    {
      "id": "indo-47",
      "kind": "bank_tx",
      "source": "indo",
      "date": "2026-01-22T00:00:00.000Z",
      "title": "HAGKAUP GARDABAER",
      "amountISK": -3609,
      "category": "Hagkaup",
      "raw": {
        "booking_date": "2026-01-22 0:0:0",
        "transaction_at": "2026-01-21 22:54:36",
        "transaction_type": "card_payment",
        "counterparty_id": "000000000001748",
        "merchant_city": "GARDABAER",
        "merchant_country_code": "ISL",
        "merchant_category_code": "5411"
      }
    },
    {
      "id": "indo-48",
      "kind": "bank_tx",
      "source": "indo",
      "date": "2026-01-22T00:00:00.000Z",
      "title": "Blaa sjoppan",
      "amountISK": -2798,
      "category": "Annað",
      "raw": {
        "booking_date": "2026-01-22 0:0:0",
        "transaction_at": "2026-01-21 22:26:2",
        "transaction_type": "card_payment",
        "counterparty_id": "8032748",
        "merchant_city": "Reykjavik",
        "merchant_country_code": "ISL",
        "merchant_category_code": "5441"
      }
    },
    {
      "id": "indo-49",
      "kind": "bank_tx",
      "source": "indo",
      "date": "2026-01-21T00:00:00.000Z",
      "title": "Arnar Kjartansson",
      "amountISK": 3000,
      "category": "Annað",
      "raw": {
        "booking_date": "2026-01-21 0:0:0",
        "transaction_at": "2026-01-21 22:54:29",
        "transaction_type": "credit_transfer",
        "counterparty_id": "1412922269",
        "merchant_city": null,
        "merchant_country_code": null,
        "merchant_category_code": null
      }
    },
    {
      "id": "indo-50",
      "kind": "bank_tx",
      "source": "indo",
      "date": "2026-01-21T00:00:00.000Z",
      "title": "Arnar Kjartansson",
      "amountISK": 5000,
      "category": "Annað",
      "raw": {
        "booking_date": "2026-01-21 0:0:0",
        "transaction_at": "2026-01-21 22:25:56",
        "transaction_type": "credit_transfer",
        "counterparty_id": "1412922269",
        "merchant_city": null,
        "merchant_country_code": null,
        "merchant_category_code": null
      }
    },
    {
      "id": "indo-51",
      "kind": "bank_tx",
      "source": "indo",
      "date": "2026-01-21T00:00:00.000Z",
